{
  "address": "0xdFE94E66cBb54b5c58cbAB5Bc17F8aC7b80F5cc6",
  "abi": [
    {
      "inputs": [],
      "stateMutability": "nonpayable",
      "type": "constructor"
    },
    {
      "anonymous": false,
      "inputs": [
        {
          "indexed": true,
          "internalType": "bytes32",
          "name": "domainSeparator",
          "type": "bytes32"
        },
        {
          "indexed": false,
          "internalType": "bytes",
          "name": "domainValue",
          "type": "bytes"
        }
      ],
      "name": "DomainRegistered",
      "type": "event"
    },
    {
      "anonymous": false,
      "inputs": [
        {
          "indexed": true,
          "internalType": "bytes32",
          "name": "typeHash",
          "type": "bytes32"
        },
        {
          "indexed": false,
          "internalType": "string",
          "name": "typeStr",
          "type": "string"
        }
      ],
      "name": "RequestTypeRegistered",
      "type": "event"
    },
    {
      "inputs": [],
      "name": "EIP712_DOMAIN_TYPE",
      "outputs": [
        {
          "internalType": "string",
          "name": "",
          "type": "string"
        }
      ],
      "stateMutability": "view",
      "type": "function"
    },
    {
      "inputs": [],
      "name": "GENERIC_PARAMS",
      "outputs": [
        {
          "internalType": "string",
          "name": "",
          "type": "string"
        }
      ],
      "stateMutability": "view",
      "type": "function"
    },
    {
      "inputs": [
        {
          "components": [
            {
              "internalType": "address",
              "name": "from",
              "type": "address"
            },
            {
              "internalType": "address",
              "name": "to",
              "type": "address"
            },
            {
              "internalType": "uint256",
              "name": "value",
              "type": "uint256"
            },
            {
              "internalType": "uint256",
              "name": "gas",
              "type": "uint256"
            },
            {
              "internalType": "uint256",
              "name": "nonce",
              "type": "uint256"
            },
            {
              "internalType": "bytes",
              "name": "data",
              "type": "bytes"
            },
            {
              "internalType": "uint256",
              "name": "validUntil",
              "type": "uint256"
            }
          ],
          "internalType": "struct IForwarder.ForwardRequest",
          "name": "req",
          "type": "tuple"
        },
        {
          "internalType": "bytes32",
          "name": "requestTypeHash",
          "type": "bytes32"
        },
        {
          "internalType": "bytes",
          "name": "suffixData",
          "type": "bytes"
        }
      ],
      "name": "_getEncoded",
      "outputs": [
        {
          "internalType": "bytes",
          "name": "",
          "type": "bytes"
        }
      ],
      "stateMutability": "pure",
      "type": "function"
    },
    {
      "inputs": [
        {
          "internalType": "bytes32",
          "name": "",
          "type": "bytes32"
        }
      ],
      "name": "domains",
      "outputs": [
        {
          "internalType": "bool",
          "name": "",
          "type": "bool"
        }
      ],
      "stateMutability": "view",
      "type": "function"
    },
    {
      "inputs": [
        {
          "components": [
            {
              "internalType": "address",
              "name": "from",
              "type": "address"
            },
            {
              "internalType": "address",
              "name": "to",
              "type": "address"
            },
            {
              "internalType": "uint256",
              "name": "value",
              "type": "uint256"
            },
            {
              "internalType": "uint256",
              "name": "gas",
              "type": "uint256"
            },
            {
              "internalType": "uint256",
              "name": "nonce",
              "type": "uint256"
            },
            {
              "internalType": "bytes",
              "name": "data",
              "type": "bytes"
            },
            {
              "internalType": "uint256",
              "name": "validUntil",
              "type": "uint256"
            }
          ],
          "internalType": "struct IForwarder.ForwardRequest",
          "name": "req",
          "type": "tuple"
        },
        {
          "internalType": "bytes32",
          "name": "domainSeparator",
          "type": "bytes32"
        },
        {
          "internalType": "bytes32",
          "name": "requestTypeHash",
          "type": "bytes32"
        },
        {
          "internalType": "bytes",
          "name": "suffixData",
          "type": "bytes"
        },
        {
          "internalType": "bytes",
          "name": "sig",
          "type": "bytes"
        }
      ],
      "name": "execute",
      "outputs": [
        {
          "internalType": "bool",
          "name": "success",
          "type": "bool"
        },
        {
          "internalType": "bytes",
          "name": "ret",
          "type": "bytes"
        }
      ],
      "stateMutability": "payable",
      "type": "function"
    },
    {
      "inputs": [
        {
          "internalType": "address",
          "name": "from",
          "type": "address"
        }
      ],
      "name": "getNonce",
      "outputs": [
        {
          "internalType": "uint256",
          "name": "",
          "type": "uint256"
        }
      ],
      "stateMutability": "view",
      "type": "function"
    },
    {
      "inputs": [
        {
          "internalType": "string",
          "name": "name",
          "type": "string"
        },
        {
          "internalType": "string",
          "name": "version",
          "type": "string"
        }
      ],
      "name": "registerDomainSeparator",
      "outputs": [],
      "stateMutability": "nonpayable",
      "type": "function"
    },
    {
      "inputs": [
        {
          "internalType": "string",
          "name": "typeName",
          "type": "string"
        },
        {
          "internalType": "string",
          "name": "typeSuffix",
          "type": "string"
        }
      ],
      "name": "registerRequestType",
      "outputs": [],
      "stateMutability": "nonpayable",
      "type": "function"
    },
    {
      "inputs": [
        {
          "internalType": "bytes32",
          "name": "",
          "type": "bytes32"
        }
      ],
      "name": "typeHashes",
      "outputs": [
        {
          "internalType": "bool",
          "name": "",
          "type": "bool"
        }
      ],
      "stateMutability": "view",
      "type": "function"
    },
    {
      "inputs": [
        {
          "components": [
            {
              "internalType": "address",
              "name": "from",
              "type": "address"
            },
            {
              "internalType": "address",
              "name": "to",
              "type": "address"
            },
            {
              "internalType": "uint256",
              "name": "value",
              "type": "uint256"
            },
            {
              "internalType": "uint256",
              "name": "gas",
              "type": "uint256"
            },
            {
              "internalType": "uint256",
              "name": "nonce",
              "type": "uint256"
            },
            {
              "internalType": "bytes",
              "name": "data",
              "type": "bytes"
            },
            {
              "internalType": "uint256",
              "name": "validUntil",
              "type": "uint256"
            }
          ],
          "internalType": "struct IForwarder.ForwardRequest",
          "name": "req",
          "type": "tuple"
        },
        {
          "internalType": "bytes32",
          "name": "domainSeparator",
          "type": "bytes32"
        },
        {
          "internalType": "bytes32",
          "name": "requestTypeHash",
          "type": "bytes32"
        },
        {
          "internalType": "bytes",
          "name": "suffixData",
          "type": "bytes"
        },
        {
          "internalType": "bytes",
          "name": "sig",
          "type": "bytes"
        }
      ],
      "name": "verify",
      "outputs": [],
      "stateMutability": "view",
      "type": "function"
    },
    {
      "stateMutability": "payable",
      "type": "receive"
    }
  ],
  "transactionHash": "0xd569eae4de86be8b192d0c349dfbe007aea57e7ba12ca8c23339855c0c493cfa",
  "receipt": {
    "to": null,
    "from": "0x3Bc21B9e5612C303e11162C1F520AD0FF734e90D",
    "contractAddress": "0xdFE94E66cBb54b5c58cbAB5Bc17F8aC7b80F5cc6",
    "transactionIndex": 0,
    "gasUsed": "1347467",
    "logsBloom": "0x00000000000000000000000000000000000000000000000000000000000000000000000000000000000000000000000000000800000000000000000000000000000000000000000000000000000000000000000000000000000000000000200000000000000000000000000000000000004000000000000000000000000000000000000000000000800002800000000010000000000000000000000000000000002000000000000000000000000000000000000000000000000000000000000000000000000000000000000000000000000000000000000000040000000000000000000000000000000000000000000000000000000000000000000000000000",
    "blockHash": "0x9a4cc9c2ec3c0f907c4a2aa0d3371b8e088e1f3df019407ec56c600954be3a27",
    "transactionHash": "0xd569eae4de86be8b192d0c349dfbe007aea57e7ba12ca8c23339855c0c493cfa",
    "logs": [
      {
        "transactionIndex": 0,
        "blockNumber": 3156895,
        "transactionHash": "0xd569eae4de86be8b192d0c349dfbe007aea57e7ba12ca8c23339855c0c493cfa",
        "address": "0xdFE94E66cBb54b5c58cbAB5Bc17F8aC7b80F5cc6",
        "topics": [
          "0x64d6bce64323458c44643c51fe45113efc882082f7b7fd5f09f0d69d2eedb202",
          "0x2510fc5e187085770200b027d9f2cc4b930768f3b2bd81daafb71ffeb53d21c4"
        ],
        "data": "0x0000000000000000000000000000000000000000000000000000000000000020000000000000000000000000000000000000000000000000000000000000006d466f72776172645265717565737428616464726573732066726f6d2c6164647265737320746f2c75696e743235362076616c75652c75696e74323536206761732c75696e74323536206e6f6e63652c627974657320646174612c75696e743235362076616c6964556e74696c2900000000000000000000000000000000000000",
        "logIndex": 0,
        "blockHash": "0x9a4cc9c2ec3c0f907c4a2aa0d3371b8e088e1f3df019407ec56c600954be3a27"
      }
    ],
    "blockNumber": 3156895,
    "cumulativeGasUsed": "1347467",
    "status": 1,
    "byzantium": true
  },
  "args": [],
  "solcInputHash": "072f9af61b42a58421632d096ac8fd71",
  "metadata": "{\"compiler\":{\"version\":\"0.8.7+commit.e28d00a7\"},\"language\":\"Solidity\",\"output\":{\"abi\":[{\"inputs\":[],\"stateMutability\":\"nonpayable\",\"type\":\"constructor\"},{\"anonymous\":false,\"inputs\":[{\"indexed\":true,\"internalType\":\"bytes32\",\"name\":\"domainSeparator\",\"type\":\"bytes32\"},{\"indexed\":false,\"internalType\":\"bytes\",\"name\":\"domainValue\",\"type\":\"bytes\"}],\"name\":\"DomainRegistered\",\"type\":\"event\"},{\"anonymous\":false,\"inputs\":[{\"indexed\":true,\"internalType\":\"bytes32\",\"name\":\"typeHash\",\"type\":\"bytes32\"},{\"indexed\":false,\"internalType\":\"string\",\"name\":\"typeStr\",\"type\":\"string\"}],\"name\":\"RequestTypeRegistered\",\"type\":\"event\"},{\"inputs\":[],\"name\":\"EIP712_DOMAIN_TYPE\",\"outputs\":[{\"internalType\":\"string\",\"name\":\"\",\"type\":\"string\"}],\"stateMutability\":\"view\",\"type\":\"function\"},{\"inputs\":[],\"name\":\"GENERIC_PARAMS\",\"outputs\":[{\"internalType\":\"string\",\"name\":\"\",\"type\":\"string\"}],\"stateMutability\":\"view\",\"type\":\"function\"},{\"inputs\":[{\"components\":[{\"internalType\":\"address\",\"name\":\"from\",\"type\":\"address\"},{\"internalType\":\"address\",\"name\":\"to\",\"type\":\"address\"},{\"internalType\":\"uint256\",\"name\":\"value\",\"type\":\"uint256\"},{\"internalType\":\"uint256\",\"name\":\"gas\",\"type\":\"uint256\"},{\"internalType\":\"uint256\",\"name\":\"nonce\",\"type\":\"uint256\"},{\"internalType\":\"bytes\",\"name\":\"data\",\"type\":\"bytes\"},{\"internalType\":\"uint256\",\"name\":\"validUntil\",\"type\":\"uint256\"}],\"internalType\":\"struct IForwarder.ForwardRequest\",\"name\":\"req\",\"type\":\"tuple\"},{\"internalType\":\"bytes32\",\"name\":\"requestTypeHash\",\"type\":\"bytes32\"},{\"internalType\":\"bytes\",\"name\":\"suffixData\",\"type\":\"bytes\"}],\"name\":\"_getEncoded\",\"outputs\":[{\"internalType\":\"bytes\",\"name\":\"\",\"type\":\"bytes\"}],\"stateMutability\":\"pure\",\"type\":\"function\"},{\"inputs\":[{\"internalType\":\"bytes32\",\"name\":\"\",\"type\":\"bytes32\"}],\"name\":\"domains\",\"outputs\":[{\"internalType\":\"bool\",\"name\":\"\",\"type\":\"bool\"}],\"stateMutability\":\"view\",\"type\":\"function\"},{\"inputs\":[{\"components\":[{\"internalType\":\"address\",\"name\":\"from\",\"type\":\"address\"},{\"internalType\":\"address\",\"name\":\"to\",\"type\":\"address\"},{\"internalType\":\"uint256\",\"name\":\"value\",\"type\":\"uint256\"},{\"internalType\":\"uint256\",\"name\":\"gas\",\"type\":\"uint256\"},{\"internalType\":\"uint256\",\"name\":\"nonce\",\"type\":\"uint256\"},{\"internalType\":\"bytes\",\"name\":\"data\",\"type\":\"bytes\"},{\"internalType\":\"uint256\",\"name\":\"validUntil\",\"type\":\"uint256\"}],\"internalType\":\"struct IForwarder.ForwardRequest\",\"name\":\"req\",\"type\":\"tuple\"},{\"internalType\":\"bytes32\",\"name\":\"domainSeparator\",\"type\":\"bytes32\"},{\"internalType\":\"bytes32\",\"name\":\"requestTypeHash\",\"type\":\"bytes32\"},{\"internalType\":\"bytes\",\"name\":\"suffixData\",\"type\":\"bytes\"},{\"internalType\":\"bytes\",\"name\":\"sig\",\"type\":\"bytes\"}],\"name\":\"execute\",\"outputs\":[{\"internalType\":\"bool\",\"name\":\"success\",\"type\":\"bool\"},{\"internalType\":\"bytes\",\"name\":\"ret\",\"type\":\"bytes\"}],\"stateMutability\":\"payable\",\"type\":\"function\"},{\"inputs\":[{\"internalType\":\"address\",\"name\":\"from\",\"type\":\"address\"}],\"name\":\"getNonce\",\"outputs\":[{\"internalType\":\"uint256\",\"name\":\"\",\"type\":\"uint256\"}],\"stateMutability\":\"view\",\"type\":\"function\"},{\"inputs\":[{\"internalType\":\"string\",\"name\":\"name\",\"type\":\"string\"},{\"internalType\":\"string\",\"name\":\"version\",\"type\":\"string\"}],\"name\":\"registerDomainSeparator\",\"outputs\":[],\"stateMutability\":\"nonpayable\",\"type\":\"function\"},{\"inputs\":[{\"internalType\":\"string\",\"name\":\"typeName\",\"type\":\"string\"},{\"internalType\":\"string\",\"name\":\"typeSuffix\",\"type\":\"string\"}],\"name\":\"registerRequestType\",\"outputs\":[],\"stateMutability\":\"nonpayable\",\"type\":\"function\"},{\"inputs\":[{\"internalType\":\"bytes32\",\"name\":\"\",\"type\":\"bytes32\"}],\"name\":\"typeHashes\",\"outputs\":[{\"internalType\":\"bool\",\"name\":\"\",\"type\":\"bool\"}],\"stateMutability\":\"view\",\"type\":\"function\"},{\"inputs\":[{\"components\":[{\"internalType\":\"address\",\"name\":\"from\",\"type\":\"address\"},{\"internalType\":\"address\",\"name\":\"to\",\"type\":\"address\"},{\"internalType\":\"uint256\",\"name\":\"value\",\"type\":\"uint256\"},{\"internalType\":\"uint256\",\"name\":\"gas\",\"type\":\"uint256\"},{\"internalType\":\"uint256\",\"name\":\"nonce\",\"type\":\"uint256\"},{\"internalType\":\"bytes\",\"name\":\"data\",\"type\":\"bytes\"},{\"internalType\":\"uint256\",\"name\":\"validUntil\",\"type\":\"uint256\"}],\"internalType\":\"struct IForwarder.ForwardRequest\",\"name\":\"req\",\"type\":\"tuple\"},{\"internalType\":\"bytes32\",\"name\":\"domainSeparator\",\"type\":\"bytes32\"},{\"internalType\":\"bytes32\",\"name\":\"requestTypeHash\",\"type\":\"bytes32\"},{\"internalType\":\"bytes\",\"name\":\"suffixData\",\"type\":\"bytes\"},{\"internalType\":\"bytes\",\"name\":\"sig\",\"type\":\"bytes\"}],\"name\":\"verify\",\"outputs\":[],\"stateMutability\":\"view\",\"type\":\"function\"},{\"stateMutability\":\"payable\",\"type\":\"receive\"}],\"devdoc\":{\"kind\":\"dev\",\"methods\":{\"registerDomainSeparator(string,string)\":{\"params\":{\"name\":\"the domain's display name\",\"version\":\"the domain/protocol version\"}},\"registerRequestType(string,string)\":{\"params\":{\"typeName\":\"- the name of the request type.\",\"typeSuffix\":\"- any extra data after the generic params.  (must add at least one param. The generic ForwardRequest type is always registered by the constructor)\"}}},\"version\":1},\"userdoc\":{\"kind\":\"user\",\"methods\":{\"registerDomainSeparator(string,string)\":{\"notice\":\"Register a new domain separator. The domain separator must have the following fields: name,version,chainId, verifyingContract. the chainId is the current network's chainId, and the verifyingContract is this forwarder. This method is given the domain name and version to create and register the domain separator value.\"},\"registerRequestType(string,string)\":{\"notice\":\"Register a new Request typehash.\"}},\"version\":1}},\"settings\":{\"compilationTarget\":{\"contracts/forwarder/Forwarder.sol\":\"Forwarder\"},\"evmVersion\":\"london\",\"libraries\":{},\"metadata\":{\"bytecodeHash\":\"ipfs\",\"useLiteralContent\":true},\"optimizer\":{\"enabled\":true,\"runs\":999999},\"remappings\":[]},\"sources\":{\"contracts/forwarder/Forwarder.sol\":{\"content\":\"// Sources flattened with hardhat v2.6.0 https://hardhat.org\\n\\n// File @openzeppelin/contracts/utils/cryptography/ECDSA.sol@v4.2.0\\n\\n// SPDX-License-Identifier: MIT\\n\\npragma solidity ^0.8.0;\\n\\n/**\\n * @dev Elliptic Curve Digital Signature Algorithm (ECDSA) operations.\\n *\\n * These functions can be used to verify that a message was signed by the holder\\n * of the private keys of a given address.\\n */\\nlibrary ECDSA {\\n    /**\\n     * @dev Returns the address that signed a hashed message (`hash`) with\\n     * `signature`. This address can then be used for verification purposes.\\n     *\\n     * The `ecrecover` EVM opcode allows for malleable (non-unique) signatures:\\n     * this function rejects them by requiring the `s` value to be in the lower\\n     * half order, and the `v` value to be either 27 or 28.\\n     *\\n     * IMPORTANT: `hash` _must_ be the result of a hash operation for the\\n     * verification to be secure: it is possible to craft signatures that\\n     * recover to arbitrary addresses for non-hashed data. A safe way to ensure\\n     * this is by receiving a hash of the original message (which may otherwise\\n     * be too long), and then calling {toEthSignedMessageHash} on it.\\n     *\\n     * Documentation for signature generation:\\n     * - with https://web3js.readthedocs.io/en/v1.3.4/web3-eth-accounts.html#sign[Web3.js]\\n     * - with https://docs.ethers.io/v5/api/signer/#Signer-signMessage[ethers]\\n     */\\n    function recover(bytes32 hash, bytes memory signature) internal pure returns (address) {\\n        // Check the signature length\\n        // - case 65: r,s,v signature (standard)\\n        // - case 64: r,vs signature (cf https://eips.ethereum.org/EIPS/eip-2098) _Available since v4.1._\\n        if (signature.length == 65) {\\n            bytes32 r;\\n            bytes32 s;\\n            uint8 v;\\n            // ecrecover takes the signature parameters, and the only way to get them\\n            // currently is to use assembly.\\n            assembly {\\n                r := mload(add(signature, 0x20))\\n                s := mload(add(signature, 0x40))\\n                v := byte(0, mload(add(signature, 0x60)))\\n            }\\n            return recover(hash, v, r, s);\\n        } else if (signature.length == 64) {\\n            bytes32 r;\\n            bytes32 vs;\\n            // ecrecover takes the signature parameters, and the only way to get them\\n            // currently is to use assembly.\\n            assembly {\\n                r := mload(add(signature, 0x20))\\n                vs := mload(add(signature, 0x40))\\n            }\\n            return recover(hash, r, vs);\\n        } else {\\n            revert(\\\"ECDSA: invalid signature length\\\");\\n        }\\n    }\\n\\n    /**\\n     * @dev Overload of {ECDSA-recover} that receives the `r` and `vs` short-signature fields separately.\\n     *\\n     * See https://eips.ethereum.org/EIPS/eip-2098[EIP-2098 short signatures]\\n     *\\n     * _Available since v4.2._\\n     */\\n    function recover(\\n        bytes32 hash,\\n        bytes32 r,\\n        bytes32 vs\\n    ) internal pure returns (address) {\\n        bytes32 s;\\n        uint8 v;\\n        assembly {\\n            s := and(vs, 0x7fffffffffffffffffffffffffffffffffffffffffffffffffffffffffffffff)\\n            v := add(shr(255, vs), 27)\\n        }\\n        return recover(hash, v, r, s);\\n    }\\n\\n    /**\\n     * @dev Overload of {ECDSA-recover} that receives the `v`, `r` and `s` signature fields separately.\\n     */\\n    function recover(\\n        bytes32 hash,\\n        uint8 v,\\n        bytes32 r,\\n        bytes32 s\\n    ) internal pure returns (address) {\\n        // EIP-2 still allows signature malleability for ecrecover(). Remove this possibility and make the signature\\n        // unique. Appendix F in the Ethereum Yellow paper (https://ethereum.github.io/yellowpaper/paper.pdf), defines\\n        // the valid range for s in (281): 0 < s < secp256k1n \\u00f7 2 + 1, and for v in (282): v \\u2208 {27, 28}. Most\\n        // signatures from current libraries generate a unique signature with an s-value in the lower half order.\\n        //\\n        // If your library generates malleable signatures, such as s-values in the upper range, calculate a new s-value\\n        // with 0xFFFFFFFFFFFFFFFFFFFFFFFFFFFFFFFEBAAEDCE6AF48A03BBFD25E8CD0364141 - s1 and flip v from 27 to 28 or\\n        // vice versa. If your library also generates signatures with 0/1 for v instead 27/28, add 27 to v to accept\\n        // these malleable signatures as well.\\n        require(\\n            uint256(s) <= 0x7FFFFFFFFFFFFFFFFFFFFFFFFFFFFFFF5D576E7357A4501DDFE92F46681B20A0,\\n            \\\"ECDSA: invalid signature 's' value\\\"\\n        );\\n        require(v == 27 || v == 28, \\\"ECDSA: invalid signature 'v' value\\\");\\n\\n        // If the signature is valid (and not malleable), return the signer address\\n        address signer = ecrecover(hash, v, r, s);\\n        require(signer != address(0), \\\"ECDSA: invalid signature\\\");\\n\\n        return signer;\\n    }\\n\\n    /**\\n     * @dev Returns an Ethereum Signed Message, created from a `hash`. This\\n     * produces hash corresponding to the one signed with the\\n     * https://eth.wiki/json-rpc/API#eth_sign[`eth_sign`]\\n     * JSON-RPC method as part of EIP-191.\\n     *\\n     * See {recover}.\\n     */\\n    function toEthSignedMessageHash(bytes32 hash) internal pure returns (bytes32) {\\n        // 32 is the length in bytes of hash,\\n        // enforced by the type signature above\\n        return keccak256(abi.encodePacked(\\\"\\\\x19Ethereum Signed Message:\\\\n32\\\", hash));\\n    }\\n\\n    /**\\n     * @dev Returns an Ethereum Signed Typed Data, created from a\\n     * `domainSeparator` and a `structHash`. This produces hash corresponding\\n     * to the one signed with the\\n     * https://eips.ethereum.org/EIPS/eip-712[`eth_signTypedData`]\\n     * JSON-RPC method as part of EIP-712.\\n     *\\n     * See {recover}.\\n     */\\n    function toTypedDataHash(bytes32 domainSeparator, bytes32 structHash) internal pure returns (bytes32) {\\n        return keccak256(abi.encodePacked(\\\"\\\\x19\\\\x01\\\", domainSeparator, structHash));\\n    }\\n}\\n\\n\\n// File contracts/forwarder/IForwarder.sol\\n\\npragma solidity ^0.8.2;\\npragma abicoder v2;\\n\\ninterface IForwarder {\\n\\n    struct ForwardRequest {\\n        address from;\\n        address to;\\n        uint256 value;\\n        uint256 gas;\\n        uint256 nonce;\\n        bytes data;\\n        uint256 validUntil;\\n    }\\n\\n    event DomainRegistered(bytes32 indexed domainSeparator, bytes domainValue);\\n\\n    event RequestTypeRegistered(bytes32 indexed typeHash, string typeStr);\\n\\n    function getNonce(address from)\\n    external view\\n    returns(uint256);\\n\\n    /**\\n     * verify the transaction would execute.\\n     * validate the signature and the nonce of the request.\\n     * revert if either signature or nonce are incorrect.\\n     * also revert if domainSeparator or requestTypeHash are not registered.\\n     */\\n    function verify(\\n        ForwardRequest calldata forwardRequest,\\n        bytes32 domainSeparator,\\n        bytes32 requestTypeHash,\\n        bytes calldata suffixData,\\n        bytes calldata signature\\n    ) external view;\\n\\n    /**\\n     * execute a transaction\\n     * @param forwardRequest - all transaction parameters\\n     * @param domainSeparator - domain used when signing this request\\n     * @param requestTypeHash - request type used when signing this request.\\n     * @param suffixData - the extension data used when signing this request.\\n     * @param signature - signature to validate.\\n     *\\n     * the transaction is verified, and then executed.\\n     * the success and ret of \\\"call\\\" are returned.\\n     * This method would revert only verification errors. target errors\\n     * are reported using the returned \\\"success\\\" and ret string\\n     */\\n    function execute(\\n        ForwardRequest calldata forwardRequest,\\n        bytes32 domainSeparator,\\n        bytes32 requestTypeHash,\\n        bytes calldata suffixData,\\n        bytes calldata signature\\n    )\\n    external payable\\n    returns (bool success, bytes memory ret);\\n\\n    /**\\n     * Register a new Request typehash.\\n     * @param typeName - the name of the request type.\\n     * @param typeSuffix - any extra data after the generic params.\\n     *  (must add at least one param. The generic ForwardRequest type is always registered by the constructor)\\n     */\\n    function registerRequestType(string calldata typeName, string calldata typeSuffix) external;\\n\\n    /**\\n     * Register a new domain separator.\\n     * The domain separator must have the following fields: name,version,chainId, verifyingContract.\\n     * the chainId is the current network's chainId, and the verifyingContract is this forwarder.\\n     * This method is given the domain name and version to create and register the domain separator value.\\n     * @param name the domain's display name\\n     * @param version the domain/protocol version\\n     */\\n    function registerDomainSeparator(string calldata name, string calldata version) external;\\n}\\n\\n\\n// File contracts/forwarder/Forwarder.sol\\n\\npragma solidity ^0.8.2;\\n\\n\\ncontract Forwarder is IForwarder {\\n    using ECDSA for bytes32;\\n\\n    string public constant GENERIC_PARAMS = \\\"address from,address to,uint256 value,uint256 gas,uint256 nonce,bytes data,uint256 validUntil\\\";\\n\\n    string public constant EIP712_DOMAIN_TYPE = \\\"EIP712Domain(string name,string version,uint256 chainId,address verifyingContract)\\\";\\n\\n    mapping(bytes32 => bool) public typeHashes;\\n    mapping(bytes32 => bool) public domains;\\n\\n    // Nonces of senders, used to prevent replay attacks\\n    mapping(address => uint256) private nonces;\\n\\n    // solhint-disable-next-line no-empty-blocks\\n    receive() external payable {}\\n\\n    function getNonce(address from)\\n    public view override\\n    returns (uint256) {\\n        return nonces[from];\\n    }\\n\\n    constructor() {     \\n        string memory requestType = string(abi.encodePacked(\\\"ForwardRequest(\\\", GENERIC_PARAMS, \\\")\\\"));\\n        registerRequestTypeInternal(requestType);\\n    }\\n\\n    function verify(\\n        ForwardRequest calldata req,\\n        bytes32 domainSeparator,\\n        bytes32 requestTypeHash,\\n        bytes calldata suffixData,\\n        bytes calldata sig)\\n    external override view {\\n\\n        _verifyNonce(req);\\n        _verifySig(req, domainSeparator, requestTypeHash, suffixData, sig);\\n    }\\n\\n    function execute(\\n        ForwardRequest calldata req,\\n        bytes32 domainSeparator,\\n        bytes32 requestTypeHash,\\n        bytes calldata suffixData,\\n        bytes calldata sig\\n    )\\n    external payable\\n    override\\n    returns (bool success, bytes memory ret) {\\n        _verifySig(req, domainSeparator, requestTypeHash, suffixData, sig);\\n        _verifyAndUpdateNonce(req);\\n\\n        require(req.validUntil == 0 || req.validUntil > block.number, \\\"FWD: request expired\\\");\\n\\n        uint gasForTransfer = 0;\\n        if ( req.value != 0 ) {\\n            gasForTransfer = 40000; //buffer in case we need to move eth after the transaction.\\n        }\\n        bytes memory callData = abi.encodePacked(req.data, req.from);\\n        require(gasleft()*63/64 >= req.gas + gasForTransfer, \\\"FWD: insufficient gas\\\");\\n        // solhint-disable-next-line avoid-low-level-calls\\n        (success,ret) = req.to.call{gas : req.gas, value : req.value}(callData);\\n        if ( req.value != 0 && address(this).balance>0 ) {\\n            // can't fail: req.from signed (off-chain) the request, so it must be an EOA...\\n            payable(req.from).transfer(address(this).balance);\\n        }\\n\\n        return (success,ret);\\n    }\\n\\n\\n    function _verifyNonce(ForwardRequest calldata req) internal view {\\n        require(nonces[req.from] == req.nonce, \\\"FWD: nonce mismatch\\\");\\n    }\\n\\n    function _verifyAndUpdateNonce(ForwardRequest calldata req) internal {\\n        require(nonces[req.from]++ == req.nonce, \\\"FWD: nonce mismatch\\\");\\n    }\\n\\n    function registerRequestType(string calldata typeName, string calldata typeSuffix) external override {\\n\\n        for (uint i = 0; i < bytes(typeName).length; i++) {\\n            bytes1 c = bytes(typeName)[i];\\n            require(c != \\\"(\\\" && c != \\\")\\\", \\\"FWD: invalid typename\\\");\\n        }\\n\\n        string memory requestType = string(abi.encodePacked(typeName, \\\"(\\\", GENERIC_PARAMS, \\\",\\\", typeSuffix));\\n        registerRequestTypeInternal(requestType);\\n    }\\n\\n    function registerDomainSeparator(string calldata name, string calldata version) external override {\\n        uint256 chainId;\\n        /* solhint-disable-next-line no-inline-assembly */\\n        assembly { chainId := chainid() }\\n\\n        bytes memory domainValue = abi.encode(\\n            keccak256(bytes(EIP712_DOMAIN_TYPE)),\\n            keccak256(bytes(name)),\\n            keccak256(bytes(version)),\\n            chainId,\\n            address(this));\\n\\n        bytes32 domainHash = keccak256(domainValue);\\n\\n        domains[domainHash] = true;\\n        emit DomainRegistered(domainHash, domainValue);\\n    }\\n\\n    function registerRequestTypeInternal(string memory requestType) internal {\\n\\n        bytes32 requestTypehash = keccak256(bytes(requestType));\\n        typeHashes[requestTypehash] = true;\\n        emit RequestTypeRegistered(requestTypehash, requestType);\\n    }\\n\\n    function _verifySig(\\n        ForwardRequest calldata req,\\n        bytes32 domainSeparator,\\n        bytes32 requestTypeHash,\\n        bytes calldata suffixData,\\n        bytes calldata sig)\\n    internal\\n    view\\n    {\\n        require(domains[domainSeparator], \\\"FWD: unregistered domain sep.\\\");\\n        require(typeHashes[requestTypeHash], \\\"FWD: unregistered typehash\\\");\\n        bytes32 digest = keccak256(abi.encodePacked(\\n                \\\"\\\\x19\\\\x01\\\", domainSeparator,\\n                keccak256(_getEncoded(req, requestTypeHash, suffixData))\\n            ));\\n        require(digest.recover(sig) == req.from, \\\"FWD: signature mismatch\\\");\\n    }\\n\\n    function _getEncoded(\\n        ForwardRequest calldata req,\\n        bytes32 requestTypeHash,\\n        bytes calldata suffixData\\n    )\\n    public\\n    pure\\n    returns (\\n        bytes memory\\n    ) {\\n        // we use encodePacked since we append suffixData as-is, not as dynamic param.\\n        // still, we must make sure all first params are encoded as abi.encode()\\n        // would encode them - as 256-bit-wide params.\\n        return abi.encodePacked(\\n            requestTypeHash,\\n            uint256(uint160(req.from)),\\n            uint256(uint160(req.to)),\\n            req.value,\\n            req.gas,\\n            req.nonce,\\n            keccak256(req.data),\\n            req.validUntil,\\n            suffixData\\n        );\\n    }\\n}\\n\",\"keccak256\":\"0xa75bd0fd13d2f573c4004e0f3404af910aa53a24e8de0d03565d8af015a0571c\",\"license\":\"MIT\"}},\"version\":1}",
  "bytecode": "0x60806040523480156200001157600080fd5b5060006040518060800160405280605d815260200162001886605d9139604051602001620000409190620000c8565b60408051601f1981840301815291905290506200005d8162000064565b5062000174565b8051602080830191909120600081815291829052604091829020805460ff19166001179055905181907f64d6bce64323458c44643c51fe45113efc882082f7b7fd5f09f0d69d2eedb20290620000bc9085906200010c565b60405180910390a25050565b6e08cdee4eec2e4c8a4cae2eacae6e85608b1b815260008251620000f481600f85016020870162000141565b602960f81b600f939091019283015250601001919050565b60208152600082518060208401526200012d81604085016020870162000141565b601f01601f19169190910160400192915050565b60005b838110156200015e57818101518382015260200162000144565b838111156200016e576000848401525b50505050565b61170280620001846000396000f3fe6080604052600436106100b55760003560e01c8063c3f28abd11610069578063d9210be51161004e578063d9210be514610204578063e024dc7f14610224578063e2b62f2d1461024557600080fd5b8063c3f28abd146101bf578063c722f177146101d457600080fd5b80632d0335ab1161009a5780632d0335ab1461012c5780639c7b45921461017d578063ad9f99c71461019f57600080fd5b8063066a310c146100c157806321fe98df146100ec57600080fd5b366100bc57005b600080fd5b3480156100cd57600080fd5b506100d6610265565b6040516100e3919061144e565b60405180910390f35b3480156100f857600080fd5b5061011c61010736600461111c565b60006020819052908152604090205460ff1681565b60405190151581526020016100e3565b34801561013857600080fd5b5061016f6101473660046110df565b73ffffffffffffffffffffffffffffffffffffffff1660009081526002602052604090205490565b6040519081526020016100e3565b34801561018957600080fd5b5061019d610198366004611135565b610281565b005b3480156101ab57600080fd5b5061019d6101ba3660046111a1565b6103b4565b3480156101cb57600080fd5b506100d66103d5565b3480156101e057600080fd5b5061011c6101ef36600461111c565b60016020526000908152604090205460ff1681565b34801561021057600080fd5b5061019d61021f366004611135565b6103f1565b6102376102323660046111a1565b61057e565b6040516100e392919061142b565b34801561025157600080fd5b506100d6610260366004611249565b610812565b6040518060800160405280605d815260200161161e605d913981565b6000469050600060405180608001604052806052815260200161167b605291398051906020012086866040516102b892919061133c565b604051809103902085856040516102d092919061133c565b6040805191829003822060208301949094528101919091526060810191909152608081018390523060a082015260c001604080517fffffffffffffffffffffffffffffffffffffffffffffffffffffffffffffffe0818403018152828252805160208083019190912060008181526001928390529390932080547fffffffffffffffffffffffffffffffffffffffffffffffffffffffffffffff0016909117905592509081907f4bc68689cbe89a4a6333a3ab0a70093874da3e5bfb71e93102027f3f073687d8906103a390859061144e565b60405180910390a250505050505050565b6103bd876108c6565b6103cc87878787878787610981565b50505050505050565b60405180608001604052806052815260200161167b6052913981565b60005b83811015610529576000858583818110610410576104106115ee565b909101357fff00000000000000000000000000000000000000000000000000000000000000169150507f280000000000000000000000000000000000000000000000000000000000000081148015906104ab57507f29000000000000000000000000000000000000000000000000000000000000007fff00000000000000000000000000000000000000000000000000000000000000821614155b610516576040517f08c379a000000000000000000000000000000000000000000000000000000000815260206004820152601560248201527f4657443a20696e76616c696420747970656e616d65000000000000000000000060448201526064015b60405180910390fd5b508061052181611586565b9150506103f4565b50600084846040518060800160405280605d815260200161161e605d9139858560405160200161055d9594939291906113a1565b604051602081830303815290604052905061057781610bea565b5050505050565b6000606061059189898989898989610981565b61059a89610c6a565b60c089013515806105ae5750438960c00135115b610614576040517f08c379a000000000000000000000000000000000000000000000000000000000815260206004820152601460248201527f4657443a20726571756573742065787069726564000000000000000000000000604482015260640161050d565b600060408a0135156106255750619c405b600061063460a08c018c611461565b61064160208e018e6110df565b6040516020016106539392919061134c565b604080517fffffffffffffffffffffffffffffffffffffffffffffffffffffffffffffffe081840301815291905290506106918260608d01356114c6565b60405a61069f90603f611519565b6106a991906114de565b1015610711576040517f08c379a000000000000000000000000000000000000000000000000000000000815260206004820152601560248201527f4657443a20696e73756666696369656e74206761730000000000000000000000604482015260640161050d565b61072160408c0160208d016110df565b73ffffffffffffffffffffffffffffffffffffffff168b606001358c604001358360405161074f9190611385565b600060405180830381858888f193505050503d806000811461078d576040519150601f19603f3d011682016040523d82523d6000602084013e610792565b606091505b50909450925060408b0135158015906107ab5750600047115b15610804576107bd60208c018c6110df565b73ffffffffffffffffffffffffffffffffffffffff166108fc479081150290604051600060405180830381858888f19350505050158015610802573d6000803e3d6000fd5b505b505097509795505050505050565b60608361082260208701876110df565b73ffffffffffffffffffffffffffffffffffffffff1661084860408801602089016110df565b73ffffffffffffffffffffffffffffffffffffffff166040880135606089013560808a013561087a60a08c018c611461565b60405161088892919061133c565b6040519081900381206108ad9796959493929160c08e0135908c908c906020016112ea565b6040516020818303038152906040529050949350505050565b6080810135600260006108dc60208501856110df565b73ffffffffffffffffffffffffffffffffffffffff1673ffffffffffffffffffffffffffffffffffffffff168152602001908152602001600020541461097e576040517f08c379a000000000000000000000000000000000000000000000000000000000815260206004820152601360248201527f4657443a206e6f6e6365206d69736d6174636800000000000000000000000000604482015260640161050d565b50565b60008681526001602052604090205460ff166109f9576040517f08c379a000000000000000000000000000000000000000000000000000000000815260206004820152601d60248201527f4657443a20756e7265676973746572656420646f6d61696e207365702e000000604482015260640161050d565b60008581526020819052604090205460ff16610a71576040517f08c379a000000000000000000000000000000000000000000000000000000000815260206004820152601a60248201527f4657443a20756e72656769737465726564207479706568617368000000000000604482015260640161050d565b600086610a8089888888610812565b8051602091820120604051610ac79392017f190100000000000000000000000000000000000000000000000000000000000081526002810192909252602282015260420190565b604080517fffffffffffffffffffffffffffffffffffffffffffffffffffffffffffffffe081840301815291905280516020918201209150610b0b908901896110df565b73ffffffffffffffffffffffffffffffffffffffff16610b6384848080601f0160208091040260200160405190810160405280939291908181526020018383808284376000920191909152508693925050610d1f9050565b73ffffffffffffffffffffffffffffffffffffffff1614610be0576040517f08c379a000000000000000000000000000000000000000000000000000000000815260206004820152601760248201527f4657443a207369676e6174757265206d69736d61746368000000000000000000604482015260640161050d565b5050505050505050565b805160208083019190912060008181529182905260409182902080547fffffffffffffffffffffffffffffffffffffffffffffffffffffffffffffff00166001179055905181907f64d6bce64323458c44643c51fe45113efc882082f7b7fd5f09f0d69d2eedb20290610c5e90859061144e565b60405180910390a25050565b608081013560026000610c8060208501856110df565b73ffffffffffffffffffffffffffffffffffffffff16815260208101919091526040016000908120805491610cb483611586565b919050551461097e576040517f08c379a000000000000000000000000000000000000000000000000000000000815260206004820152601360248201527f4657443a206e6f6e6365206d69736d6174636800000000000000000000000000604482015260640161050d565b6000815160411415610d535760208201516040830151606084015160001a610d4986828585610de3565b9350505050610ddd565b815160401415610d7b5760208201516040830151610d7285838361103b565b92505050610ddd565b6040517f08c379a000000000000000000000000000000000000000000000000000000000815260206004820152601f60248201527f45434453413a20696e76616c6964207369676e6174757265206c656e67746800604482015260640161050d565b92915050565b60007f7fffffffffffffffffffffffffffffff5d576e7357a4501ddfe92f46681b20a0821115610e95576040517f08c379a000000000000000000000000000000000000000000000000000000000815260206004820152602260248201527f45434453413a20696e76616c6964207369676e6174757265202773272076616c60448201527f7565000000000000000000000000000000000000000000000000000000000000606482015260840161050d565b8360ff16601b1480610eaa57508360ff16601c145b610f36576040517f08c379a000000000000000000000000000000000000000000000000000000000815260206004820152602260248201527f45434453413a20696e76616c6964207369676e6174757265202776272076616c60448201527f7565000000000000000000000000000000000000000000000000000000000000606482015260840161050d565b6040805160008082526020820180845288905260ff871692820192909252606081018590526080810184905260019060a0016020604051602081039080840390855afa158015610f8a573d6000803e3d6000fd5b50506040517fffffffffffffffffffffffffffffffffffffffffffffffffffffffffffffffe0015191505073ffffffffffffffffffffffffffffffffffffffff8116611032576040517f08c379a000000000000000000000000000000000000000000000000000000000815260206004820152601860248201527f45434453413a20696e76616c6964207369676e61747572650000000000000000604482015260640161050d565b95945050505050565b60007f7fffffffffffffffffffffffffffffffffffffffffffffffffffffffffffffff821660ff83901c601b0161107486828785610de3565b9695505050505050565b60008083601f84011261109057600080fd5b50813567ffffffffffffffff8111156110a857600080fd5b6020830191508360208285010111156110c057600080fd5b9250929050565b600060e082840312156110d957600080fd5b50919050565b6000602082840312156110f157600080fd5b813573ffffffffffffffffffffffffffffffffffffffff8116811461111557600080fd5b9392505050565b60006020828403121561112e57600080fd5b5035919050565b6000806000806040858703121561114b57600080fd5b843567ffffffffffffffff8082111561116357600080fd5b61116f8883890161107e565b9096509450602087013591508082111561118857600080fd5b506111958782880161107e565b95989497509550505050565b600080600080600080600060a0888a0312156111bc57600080fd5b873567ffffffffffffffff808211156111d457600080fd5b6111e08b838c016110c7565b985060208a0135975060408a0135965060608a013591508082111561120457600080fd5b6112108b838c0161107e565b909650945060808a013591508082111561122957600080fd5b506112368a828b0161107e565b989b979a50959850939692959293505050565b6000806000806060858703121561125f57600080fd5b843567ffffffffffffffff8082111561127757600080fd5b611283888389016110c7565b955060208701359450604087013591508082111561118857600080fd5b600081518084526112b8816020860160208601611556565b601f017fffffffffffffffffffffffffffffffffffffffffffffffffffffffffffffffe0169290920160200192915050565b8a81528960208201528860408201528760608201528660808201528560a08201528460c08201528360e082015260006101008385828501376000929093019092019081529a9950505050505050505050565b8183823760009101908152919050565b8284823760609190911b7fffffffffffffffffffffffffffffffffffffffff000000000000000000000000169101908152601401919050565b60008251611397818460208701611556565b9190910192915050565b848682376000858201600081527f2800000000000000000000000000000000000000000000000000000000000000815285516113e4816001840160208a01611556565b7f2c00000000000000000000000000000000000000000000000000000000000000600192909101918201528385600283013760009301600201928352509095945050505050565b821515815260406020820152600061144660408301846112a0565b949350505050565b60208152600061111560208301846112a0565b60008083357fffffffffffffffffffffffffffffffffffffffffffffffffffffffffffffffe184360301811261149657600080fd5b83018035915067ffffffffffffffff8211156114b157600080fd5b6020019150368190038213156110c057600080fd5b600082198211156114d9576114d96115bf565b500190565b600082611514577f4e487b7100000000000000000000000000000000000000000000000000000000600052601260045260246000fd5b500490565b6000817fffffffffffffffffffffffffffffffffffffffffffffffffffffffffffffffff0483118215151615611551576115516115bf565b500290565b60005b83811015611571578181015183820152602001611559565b83811115611580576000848401525b50505050565b60007fffffffffffffffffffffffffffffffffffffffffffffffffffffffffffffffff8214156115b8576115b86115bf565b5060010190565b7f4e487b7100000000000000000000000000000000000000000000000000000000600052601160045260246000fd5b7f4e487b7100000000000000000000000000000000000000000000000000000000600052603260045260246000fdfe616464726573732066726f6d2c6164647265737320746f2c75696e743235362076616c75652c75696e74323536206761732c75696e74323536206e6f6e63652c627974657320646174612c75696e743235362076616c6964556e74696c454950373132446f6d61696e28737472696e67206e616d652c737472696e672076657273696f6e2c75696e7432353620636861696e49642c6164647265737320766572696679696e67436f6e747261637429a26469706673582212202c60c78db207ddb6c5e2c21e12e8c580a443d9f3a0c16390b85c5015f820f6cc64736f6c63430008070033616464726573732066726f6d2c6164647265737320746f2c75696e743235362076616c75652c75696e74323536206761732c75696e74323536206e6f6e63652c627974657320646174612c75696e743235362076616c6964556e74696c",
  "deployedBytecode": "0x6080604052600436106100b55760003560e01c8063c3f28abd11610069578063d9210be51161004e578063d9210be514610204578063e024dc7f14610224578063e2b62f2d1461024557600080fd5b8063c3f28abd146101bf578063c722f177146101d457600080fd5b80632d0335ab1161009a5780632d0335ab1461012c5780639c7b45921461017d578063ad9f99c71461019f57600080fd5b8063066a310c146100c157806321fe98df146100ec57600080fd5b366100bc57005b600080fd5b3480156100cd57600080fd5b506100d6610265565b6040516100e3919061144e565b60405180910390f35b3480156100f857600080fd5b5061011c61010736600461111c565b60006020819052908152604090205460ff1681565b60405190151581526020016100e3565b34801561013857600080fd5b5061016f6101473660046110df565b73ffffffffffffffffffffffffffffffffffffffff1660009081526002602052604090205490565b6040519081526020016100e3565b34801561018957600080fd5b5061019d610198366004611135565b610281565b005b3480156101ab57600080fd5b5061019d6101ba3660046111a1565b6103b4565b3480156101cb57600080fd5b506100d66103d5565b3480156101e057600080fd5b5061011c6101ef36600461111c565b60016020526000908152604090205460ff1681565b34801561021057600080fd5b5061019d61021f366004611135565b6103f1565b6102376102323660046111a1565b61057e565b6040516100e392919061142b565b34801561025157600080fd5b506100d6610260366004611249565b610812565b6040518060800160405280605d815260200161161e605d913981565b6000469050600060405180608001604052806052815260200161167b605291398051906020012086866040516102b892919061133c565b604051809103902085856040516102d092919061133c565b6040805191829003822060208301949094528101919091526060810191909152608081018390523060a082015260c001604080517fffffffffffffffffffffffffffffffffffffffffffffffffffffffffffffffe0818403018152828252805160208083019190912060008181526001928390529390932080547fffffffffffffffffffffffffffffffffffffffffffffffffffffffffffffff0016909117905592509081907f4bc68689cbe89a4a6333a3ab0a70093874da3e5bfb71e93102027f3f073687d8906103a390859061144e565b60405180910390a250505050505050565b6103bd876108c6565b6103cc87878787878787610981565b50505050505050565b60405180608001604052806052815260200161167b6052913981565b60005b83811015610529576000858583818110610410576104106115ee565b909101357fff00000000000000000000000000000000000000000000000000000000000000169150507f280000000000000000000000000000000000000000000000000000000000000081148015906104ab57507f29000000000000000000000000000000000000000000000000000000000000007fff00000000000000000000000000000000000000000000000000000000000000821614155b610516576040517f08c379a000000000000000000000000000000000000000000000000000000000815260206004820152601560248201527f4657443a20696e76616c696420747970656e616d65000000000000000000000060448201526064015b60405180910390fd5b508061052181611586565b9150506103f4565b50600084846040518060800160405280605d815260200161161e605d9139858560405160200161055d9594939291906113a1565b604051602081830303815290604052905061057781610bea565b5050505050565b6000606061059189898989898989610981565b61059a89610c6a565b60c089013515806105ae5750438960c00135115b610614576040517f08c379a000000000000000000000000000000000000000000000000000000000815260206004820152601460248201527f4657443a20726571756573742065787069726564000000000000000000000000604482015260640161050d565b600060408a0135156106255750619c405b600061063460a08c018c611461565b61064160208e018e6110df565b6040516020016106539392919061134c565b604080517fffffffffffffffffffffffffffffffffffffffffffffffffffffffffffffffe081840301815291905290506106918260608d01356114c6565b60405a61069f90603f611519565b6106a991906114de565b1015610711576040517f08c379a000000000000000000000000000000000000000000000000000000000815260206004820152601560248201527f4657443a20696e73756666696369656e74206761730000000000000000000000604482015260640161050d565b61072160408c0160208d016110df565b73ffffffffffffffffffffffffffffffffffffffff168b606001358c604001358360405161074f9190611385565b600060405180830381858888f193505050503d806000811461078d576040519150601f19603f3d011682016040523d82523d6000602084013e610792565b606091505b50909450925060408b0135158015906107ab5750600047115b15610804576107bd60208c018c6110df565b73ffffffffffffffffffffffffffffffffffffffff166108fc479081150290604051600060405180830381858888f19350505050158015610802573d6000803e3d6000fd5b505b505097509795505050505050565b60608361082260208701876110df565b73ffffffffffffffffffffffffffffffffffffffff1661084860408801602089016110df565b73ffffffffffffffffffffffffffffffffffffffff166040880135606089013560808a013561087a60a08c018c611461565b60405161088892919061133c565b6040519081900381206108ad9796959493929160c08e0135908c908c906020016112ea565b6040516020818303038152906040529050949350505050565b6080810135600260006108dc60208501856110df565b73ffffffffffffffffffffffffffffffffffffffff1673ffffffffffffffffffffffffffffffffffffffff168152602001908152602001600020541461097e576040517f08c379a000000000000000000000000000000000000000000000000000000000815260206004820152601360248201527f4657443a206e6f6e6365206d69736d6174636800000000000000000000000000604482015260640161050d565b50565b60008681526001602052604090205460ff166109f9576040517f08c379a000000000000000000000000000000000000000000000000000000000815260206004820152601d60248201527f4657443a20756e7265676973746572656420646f6d61696e207365702e000000604482015260640161050d565b60008581526020819052604090205460ff16610a71576040517f08c379a000000000000000000000000000000000000000000000000000000000815260206004820152601a60248201527f4657443a20756e72656769737465726564207479706568617368000000000000604482015260640161050d565b600086610a8089888888610812565b8051602091820120604051610ac79392017f190100000000000000000000000000000000000000000000000000000000000081526002810192909252602282015260420190565b604080517fffffffffffffffffffffffffffffffffffffffffffffffffffffffffffffffe081840301815291905280516020918201209150610b0b908901896110df565b73ffffffffffffffffffffffffffffffffffffffff16610b6384848080601f0160208091040260200160405190810160405280939291908181526020018383808284376000920191909152508693925050610d1f9050565b73ffffffffffffffffffffffffffffffffffffffff1614610be0576040517f08c379a000000000000000000000000000000000000000000000000000000000815260206004820152601760248201527f4657443a207369676e6174757265206d69736d61746368000000000000000000604482015260640161050d565b5050505050505050565b805160208083019190912060008181529182905260409182902080547fffffffffffffffffffffffffffffffffffffffffffffffffffffffffffffff00166001179055905181907f64d6bce64323458c44643c51fe45113efc882082f7b7fd5f09f0d69d2eedb20290610c5e90859061144e565b60405180910390a25050565b608081013560026000610c8060208501856110df565b73ffffffffffffffffffffffffffffffffffffffff16815260208101919091526040016000908120805491610cb483611586565b919050551461097e576040517f08c379a000000000000000000000000000000000000000000000000000000000815260206004820152601360248201527f4657443a206e6f6e6365206d69736d6174636800000000000000000000000000604482015260640161050d565b6000815160411415610d535760208201516040830151606084015160001a610d4986828585610de3565b9350505050610ddd565b815160401415610d7b5760208201516040830151610d7285838361103b565b92505050610ddd565b6040517f08c379a000000000000000000000000000000000000000000000000000000000815260206004820152601f60248201527f45434453413a20696e76616c6964207369676e6174757265206c656e67746800604482015260640161050d565b92915050565b60007f7fffffffffffffffffffffffffffffff5d576e7357a4501ddfe92f46681b20a0821115610e95576040517f08c379a000000000000000000000000000000000000000000000000000000000815260206004820152602260248201527f45434453413a20696e76616c6964207369676e6174757265202773272076616c60448201527f7565000000000000000000000000000000000000000000000000000000000000606482015260840161050d565b8360ff16601b1480610eaa57508360ff16601c145b610f36576040517f08c379a000000000000000000000000000000000000000000000000000000000815260206004820152602260248201527f45434453413a20696e76616c6964207369676e6174757265202776272076616c60448201527f7565000000000000000000000000000000000000000000000000000000000000606482015260840161050d565b6040805160008082526020820180845288905260ff871692820192909252606081018590526080810184905260019060a0016020604051602081039080840390855afa158015610f8a573d6000803e3d6000fd5b50506040517fffffffffffffffffffffffffffffffffffffffffffffffffffffffffffffffe0015191505073ffffffffffffffffffffffffffffffffffffffff8116611032576040517f08c379a000000000000000000000000000000000000000000000000000000000815260206004820152601860248201527f45434453413a20696e76616c6964207369676e61747572650000000000000000604482015260640161050d565b95945050505050565b60007f7fffffffffffffffffffffffffffffffffffffffffffffffffffffffffffffff821660ff83901c601b0161107486828785610de3565b9695505050505050565b60008083601f84011261109057600080fd5b50813567ffffffffffffffff8111156110a857600080fd5b6020830191508360208285010111156110c057600080fd5b9250929050565b600060e082840312156110d957600080fd5b50919050565b6000602082840312156110f157600080fd5b813573ffffffffffffffffffffffffffffffffffffffff8116811461111557600080fd5b9392505050565b60006020828403121561112e57600080fd5b5035919050565b6000806000806040858703121561114b57600080fd5b843567ffffffffffffffff8082111561116357600080fd5b61116f8883890161107e565b9096509450602087013591508082111561118857600080fd5b506111958782880161107e565b95989497509550505050565b600080600080600080600060a0888a0312156111bc57600080fd5b873567ffffffffffffffff808211156111d457600080fd5b6111e08b838c016110c7565b985060208a0135975060408a0135965060608a013591508082111561120457600080fd5b6112108b838c0161107e565b909650945060808a013591508082111561122957600080fd5b506112368a828b0161107e565b989b979a50959850939692959293505050565b6000806000806060858703121561125f57600080fd5b843567ffffffffffffffff8082111561127757600080fd5b611283888389016110c7565b955060208701359450604087013591508082111561118857600080fd5b600081518084526112b8816020860160208601611556565b601f017fffffffffffffffffffffffffffffffffffffffffffffffffffffffffffffffe0169290920160200192915050565b8a81528960208201528860408201528760608201528660808201528560a08201528460c08201528360e082015260006101008385828501376000929093019092019081529a9950505050505050505050565b8183823760009101908152919050565b8284823760609190911b7fffffffffffffffffffffffffffffffffffffffff000000000000000000000000169101908152601401919050565b60008251611397818460208701611556565b9190910192915050565b848682376000858201600081527f2800000000000000000000000000000000000000000000000000000000000000815285516113e4816001840160208a01611556565b7f2c00000000000000000000000000000000000000000000000000000000000000600192909101918201528385600283013760009301600201928352509095945050505050565b821515815260406020820152600061144660408301846112a0565b949350505050565b60208152600061111560208301846112a0565b60008083357fffffffffffffffffffffffffffffffffffffffffffffffffffffffffffffffe184360301811261149657600080fd5b83018035915067ffffffffffffffff8211156114b157600080fd5b6020019150368190038213156110c057600080fd5b600082198211156114d9576114d96115bf565b500190565b600082611514577f4e487b7100000000000000000000000000000000000000000000000000000000600052601260045260246000fd5b500490565b6000817fffffffffffffffffffffffffffffffffffffffffffffffffffffffffffffffff0483118215151615611551576115516115bf565b500290565b60005b83811015611571578181015183820152602001611559565b83811115611580576000848401525b50505050565b60007fffffffffffffffffffffffffffffffffffffffffffffffffffffffffffffffff8214156115b8576115b86115bf565b5060010190565b7f4e487b7100000000000000000000000000000000000000000000000000000000600052601160045260246000fd5b7f4e487b7100000000000000000000000000000000000000000000000000000000600052603260045260246000fdfe616464726573732066726f6d2c6164647265737320746f2c75696e743235362076616c75652c75696e74323536206761732c75696e74323536206e6f6e63652c627974657320646174612c75696e743235362076616c6964556e74696c454950373132446f6d61696e28737472696e67206e616d652c737472696e672076657273696f6e2c75696e7432353620636861696e49642c6164647265737320766572696679696e67436f6e747261637429a26469706673582212202c60c78db207ddb6c5e2c21e12e8c580a443d9f3a0c16390b85c5015f820f6cc64736f6c63430008070033",
  "devdoc": {
    "kind": "dev",
    "methods": {
      "registerDomainSeparator(string,string)": {
        "params": {
          "name": "the domain's display name",
          "version": "the domain/protocol version"
        }
      },
      "registerRequestType(string,string)": {
        "params": {
          "typeName": "- the name of the request type.",
          "typeSuffix": "- any extra data after the generic params.  (must add at least one param. The generic ForwardRequest type is always registered by the constructor)"
        }
      }
    },
    "version": 1
  },
  "userdoc": {
    "kind": "user",
    "methods": {
      "registerDomainSeparator(string,string)": {
        "notice": "Register a new domain separator. The domain separator must have the following fields: name,version,chainId, verifyingContract. the chainId is the current network's chainId, and the verifyingContract is this forwarder. This method is given the domain name and version to create and register the domain separator value."
      },
      "registerRequestType(string,string)": {
        "notice": "Register a new Request typehash."
      }
    },
    "version": 1
  },
  "storageLayout": {
    "storage": [
      {
        "astId": 285,
        "contract": "contracts/forwarder/Forwarder.sol:Forwarder",
        "label": "typeHashes",
        "offset": 0,
        "slot": "0",
        "type": "t_mapping(t_bytes32,t_bool)"
      },
      {
        "astId": 289,
        "contract": "contracts/forwarder/Forwarder.sol:Forwarder",
        "label": "domains",
        "offset": 0,
        "slot": "1",
        "type": "t_mapping(t_bytes32,t_bool)"
      },
      {
        "astId": 293,
        "contract": "contracts/forwarder/Forwarder.sol:Forwarder",
        "label": "nonces",
        "offset": 0,
        "slot": "2",
        "type": "t_mapping(t_address,t_uint256)"
      }
    ],
    "types": {
      "t_address": {
        "encoding": "inplace",
        "label": "address",
        "numberOfBytes": "20"
      },
      "t_bool": {
        "encoding": "inplace",
        "label": "bool",
        "numberOfBytes": "1"
      },
      "t_bytes32": {
        "encoding": "inplace",
        "label": "bytes32",
        "numberOfBytes": "32"
      },
      "t_mapping(t_address,t_uint256)": {
        "encoding": "mapping",
        "key": "t_address",
        "label": "mapping(address => uint256)",
        "numberOfBytes": "32",
        "value": "t_uint256"
      },
      "t_mapping(t_bytes32,t_bool)": {
        "encoding": "mapping",
        "key": "t_bytes32",
        "label": "mapping(bytes32 => bool)",
        "numberOfBytes": "32",
        "value": "t_bool"
      },
      "t_uint256": {
        "encoding": "inplace",
        "label": "uint256",
        "numberOfBytes": "32"
      }
    }
  }
}