{
  "address": "0x2b9ee49F67dd523302B57F6198449D1660d05712",
  "abi": [
    {
      "inputs": [
        {
          "internalType": "address",
          "name": "admin_",
          "type": "address"
        },
        {
          "internalType": "uint256",
          "name": "delay_",
          "type": "uint256"
        }
      ],
      "stateMutability": "nonpayable",
      "type": "constructor"
    },
    {
      "anonymous": false,
      "inputs": [
        {
          "indexed": true,
          "internalType": "bytes32",
          "name": "txHash",
          "type": "bytes32"
        },
        {
          "indexed": true,
          "internalType": "address",
          "name": "target",
          "type": "address"
        },
        {
          "indexed": false,
          "internalType": "uint256",
          "name": "value",
          "type": "uint256"
        },
        {
          "indexed": false,
          "internalType": "string",
          "name": "signature",
          "type": "string"
        },
        {
          "indexed": false,
          "internalType": "bytes",
          "name": "data",
          "type": "bytes"
        },
        {
          "indexed": false,
          "internalType": "uint256",
          "name": "eta",
          "type": "uint256"
        }
      ],
      "name": "CancelTransaction",
      "type": "event"
    },
    {
      "anonymous": false,
      "inputs": [
        {
          "indexed": true,
          "internalType": "bytes32",
          "name": "txHash",
          "type": "bytes32"
        },
        {
          "indexed": true,
          "internalType": "address",
          "name": "target",
          "type": "address"
        },
        {
          "indexed": false,
          "internalType": "uint256",
          "name": "value",
          "type": "uint256"
        },
        {
          "indexed": false,
          "internalType": "string",
          "name": "signature",
          "type": "string"
        },
        {
          "indexed": false,
          "internalType": "bytes",
          "name": "data",
          "type": "bytes"
        },
        {
          "indexed": false,
          "internalType": "uint256",
          "name": "eta",
          "type": "uint256"
        }
      ],
      "name": "ExecuteTransaction",
      "type": "event"
    },
    {
      "anonymous": false,
      "inputs": [
        {
          "indexed": true,
          "internalType": "address",
          "name": "newAdmin",
          "type": "address"
        }
      ],
      "name": "NewAdmin",
      "type": "event"
    },
    {
      "anonymous": false,
      "inputs": [
        {
          "indexed": true,
          "internalType": "uint256",
          "name": "newDelay",
          "type": "uint256"
        }
      ],
      "name": "NewDelay",
      "type": "event"
    },
    {
      "anonymous": false,
      "inputs": [
        {
          "indexed": true,
          "internalType": "address",
          "name": "newPendingAdmin",
          "type": "address"
        }
      ],
      "name": "NewPendingAdmin",
      "type": "event"
    },
    {
      "anonymous": false,
      "inputs": [
        {
          "indexed": true,
          "internalType": "bytes32",
          "name": "txHash",
          "type": "bytes32"
        },
        {
          "indexed": true,
          "internalType": "address",
          "name": "target",
          "type": "address"
        },
        {
          "indexed": false,
          "internalType": "uint256",
          "name": "value",
          "type": "uint256"
        },
        {
          "indexed": false,
          "internalType": "string",
          "name": "signature",
          "type": "string"
        },
        {
          "indexed": false,
          "internalType": "bytes",
          "name": "data",
          "type": "bytes"
        },
        {
          "indexed": false,
          "internalType": "uint256",
          "name": "eta",
          "type": "uint256"
        }
      ],
      "name": "QueueTransaction",
      "type": "event"
    },
    {
      "inputs": [],
      "name": "GRACE_PERIOD",
      "outputs": [
        {
          "internalType": "uint256",
          "name": "",
          "type": "uint256"
        }
      ],
      "stateMutability": "view",
      "type": "function"
    },
    {
      "inputs": [],
      "name": "MAXIMUM_DELAY",
      "outputs": [
        {
          "internalType": "uint256",
          "name": "",
          "type": "uint256"
        }
      ],
      "stateMutability": "view",
      "type": "function"
    },
    {
      "inputs": [],
      "name": "MINIMUM_DELAY",
      "outputs": [
        {
          "internalType": "uint256",
          "name": "",
          "type": "uint256"
        }
      ],
      "stateMutability": "view",
      "type": "function"
    },
    {
      "inputs": [],
      "name": "acceptAdmin",
      "outputs": [],
      "stateMutability": "nonpayable",
      "type": "function"
    },
    {
      "inputs": [],
      "name": "admin",
      "outputs": [
        {
          "internalType": "address",
          "name": "",
          "type": "address"
        }
      ],
      "stateMutability": "view",
      "type": "function"
    },
    {
      "inputs": [],
      "name": "admin_initialized",
      "outputs": [
        {
          "internalType": "bool",
          "name": "",
          "type": "bool"
        }
      ],
      "stateMutability": "view",
      "type": "function"
    },
    {
      "inputs": [
        {
          "internalType": "address",
          "name": "target",
          "type": "address"
        },
        {
          "internalType": "uint256",
          "name": "value",
          "type": "uint256"
        },
        {
          "internalType": "string",
          "name": "signature",
          "type": "string"
        },
        {
          "internalType": "bytes",
          "name": "data",
          "type": "bytes"
        },
        {
          "internalType": "uint256",
          "name": "eta",
          "type": "uint256"
        }
      ],
      "name": "cancelTransaction",
      "outputs": [],
      "stateMutability": "nonpayable",
      "type": "function"
    },
    {
      "inputs": [],
      "name": "delay",
      "outputs": [
        {
          "internalType": "uint256",
          "name": "",
          "type": "uint256"
        }
      ],
      "stateMutability": "view",
      "type": "function"
    },
    {
      "inputs": [
        {
          "internalType": "address",
          "name": "target",
          "type": "address"
        },
        {
          "internalType": "uint256",
          "name": "value",
          "type": "uint256"
        },
        {
          "internalType": "string",
          "name": "signature",
          "type": "string"
        },
        {
          "internalType": "bytes",
          "name": "data",
          "type": "bytes"
        },
        {
          "internalType": "uint256",
          "name": "eta",
          "type": "uint256"
        }
      ],
      "name": "executeTransaction",
      "outputs": [
        {
          "internalType": "bytes",
          "name": "",
          "type": "bytes"
        }
      ],
      "stateMutability": "payable",
      "type": "function"
    },
    {
      "inputs": [],
      "name": "pendingAdmin",
      "outputs": [
        {
          "internalType": "address",
          "name": "",
          "type": "address"
        }
      ],
      "stateMutability": "view",
      "type": "function"
    },
    {
      "inputs": [
        {
          "internalType": "address",
          "name": "target",
          "type": "address"
        },
        {
          "internalType": "uint256",
          "name": "value",
          "type": "uint256"
        },
        {
          "internalType": "string",
          "name": "signature",
          "type": "string"
        },
        {
          "internalType": "bytes",
          "name": "data",
          "type": "bytes"
        },
        {
          "internalType": "uint256",
          "name": "eta",
          "type": "uint256"
        }
      ],
      "name": "queueTransaction",
      "outputs": [
        {
          "internalType": "bytes32",
          "name": "",
          "type": "bytes32"
        }
      ],
      "stateMutability": "nonpayable",
      "type": "function"
    },
    {
      "inputs": [
        {
          "internalType": "bytes32",
          "name": "",
          "type": "bytes32"
        }
      ],
      "name": "queuedTransactions",
      "outputs": [
        {
          "internalType": "bool",
          "name": "",
          "type": "bool"
        }
      ],
      "stateMutability": "view",
      "type": "function"
    },
    {
      "inputs": [
        {
          "internalType": "uint256",
          "name": "delay_",
          "type": "uint256"
        }
      ],
      "name": "setDelay",
      "outputs": [],
      "stateMutability": "nonpayable",
      "type": "function"
    },
    {
      "inputs": [
        {
          "internalType": "address",
          "name": "pendingAdmin_",
          "type": "address"
        }
      ],
      "name": "setPendingAdmin",
      "outputs": [],
      "stateMutability": "nonpayable",
      "type": "function"
    },
    {
      "stateMutability": "payable",
      "type": "receive"
    }
  ],
  "transactionHash": "0x55650e1ba705b992e3d3c7a74b039630c170779be3670f5bb8f8edbf10520543",
  "receipt": {
    "to": null,
    "from": "0x3Bc21B9e5612C303e11162C1F520AD0FF734e90D",
    "contractAddress": "0x2b9ee49F67dd523302B57F6198449D1660d05712",
    "transactionIndex": 0,
    "gasUsed": "1218943",
    "logsBloom": "0x00000000000000000000000000000000000000000000000000000000000000000000000000000000000000000000000000000000000000000000000000000000000000000000000000000000000000000000000000000000000000000000000000000000000000000000000000000000000000000000000000000000000000000000000000000000000000000000000000000000000000000000000000000000000000000000000000000000000000000000000000000000000000000000000000000000000000000000000000000000000000000000000000000000000000000000000000000000000000000000000000000000000000000000000000000000",
    "blockHash": "0x2484fc39b34f99f2d31e8f240d62b843e08cedd920cd2da7244572101ff7e0b7",
    "transactionHash": "0x55650e1ba705b992e3d3c7a74b039630c170779be3670f5bb8f8edbf10520543",
    "logs": [],
    "blockNumber": 3157560,
    "cumulativeGasUsed": "1218943",
    "status": 1,
    "byzantium": true
  },
  "args": [
    "0x3Bc21B9e5612C303e11162C1F520AD0FF734e90D",
    21600
  ],
  "solcInputHash": "5808d1def238899df1e8b935bc45d39f",
  "metadata": "{\"compiler\":{\"version\":\"0.8.2+commit.661d1103\"},\"language\":\"Solidity\",\"output\":{\"abi\":[{\"inputs\":[{\"internalType\":\"address\",\"name\":\"admin_\",\"type\":\"address\"},{\"internalType\":\"uint256\",\"name\":\"delay_\",\"type\":\"uint256\"}],\"stateMutability\":\"nonpayable\",\"type\":\"constructor\"},{\"anonymous\":false,\"inputs\":[{\"indexed\":true,\"internalType\":\"bytes32\",\"name\":\"txHash\",\"type\":\"bytes32\"},{\"indexed\":true,\"internalType\":\"address\",\"name\":\"target\",\"type\":\"address\"},{\"indexed\":false,\"internalType\":\"uint256\",\"name\":\"value\",\"type\":\"uint256\"},{\"indexed\":false,\"internalType\":\"string\",\"name\":\"signature\",\"type\":\"string\"},{\"indexed\":false,\"internalType\":\"bytes\",\"name\":\"data\",\"type\":\"bytes\"},{\"indexed\":false,\"internalType\":\"uint256\",\"name\":\"eta\",\"type\":\"uint256\"}],\"name\":\"CancelTransaction\",\"type\":\"event\"},{\"anonymous\":false,\"inputs\":[{\"indexed\":true,\"internalType\":\"bytes32\",\"name\":\"txHash\",\"type\":\"bytes32\"},{\"indexed\":true,\"internalType\":\"address\",\"name\":\"target\",\"type\":\"address\"},{\"indexed\":false,\"internalType\":\"uint256\",\"name\":\"value\",\"type\":\"uint256\"},{\"indexed\":false,\"internalType\":\"string\",\"name\":\"signature\",\"type\":\"string\"},{\"indexed\":false,\"internalType\":\"bytes\",\"name\":\"data\",\"type\":\"bytes\"},{\"indexed\":false,\"internalType\":\"uint256\",\"name\":\"eta\",\"type\":\"uint256\"}],\"name\":\"ExecuteTransaction\",\"type\":\"event\"},{\"anonymous\":false,\"inputs\":[{\"indexed\":true,\"internalType\":\"address\",\"name\":\"newAdmin\",\"type\":\"address\"}],\"name\":\"NewAdmin\",\"type\":\"event\"},{\"anonymous\":false,\"inputs\":[{\"indexed\":true,\"internalType\":\"uint256\",\"name\":\"newDelay\",\"type\":\"uint256\"}],\"name\":\"NewDelay\",\"type\":\"event\"},{\"anonymous\":false,\"inputs\":[{\"indexed\":true,\"internalType\":\"address\",\"name\":\"newPendingAdmin\",\"type\":\"address\"}],\"name\":\"NewPendingAdmin\",\"type\":\"event\"},{\"anonymous\":false,\"inputs\":[{\"indexed\":true,\"internalType\":\"bytes32\",\"name\":\"txHash\",\"type\":\"bytes32\"},{\"indexed\":true,\"internalType\":\"address\",\"name\":\"target\",\"type\":\"address\"},{\"indexed\":false,\"internalType\":\"uint256\",\"name\":\"value\",\"type\":\"uint256\"},{\"indexed\":false,\"internalType\":\"string\",\"name\":\"signature\",\"type\":\"string\"},{\"indexed\":false,\"internalType\":\"bytes\",\"name\":\"data\",\"type\":\"bytes\"},{\"indexed\":false,\"internalType\":\"uint256\",\"name\":\"eta\",\"type\":\"uint256\"}],\"name\":\"QueueTransaction\",\"type\":\"event\"},{\"inputs\":[],\"name\":\"GRACE_PERIOD\",\"outputs\":[{\"internalType\":\"uint256\",\"name\":\"\",\"type\":\"uint256\"}],\"stateMutability\":\"view\",\"type\":\"function\"},{\"inputs\":[],\"name\":\"MAXIMUM_DELAY\",\"outputs\":[{\"internalType\":\"uint256\",\"name\":\"\",\"type\":\"uint256\"}],\"stateMutability\":\"view\",\"type\":\"function\"},{\"inputs\":[],\"name\":\"MINIMUM_DELAY\",\"outputs\":[{\"internalType\":\"uint256\",\"name\":\"\",\"type\":\"uint256\"}],\"stateMutability\":\"view\",\"type\":\"function\"},{\"inputs\":[],\"name\":\"acceptAdmin\",\"outputs\":[],\"stateMutability\":\"nonpayable\",\"type\":\"function\"},{\"inputs\":[],\"name\":\"admin\",\"outputs\":[{\"internalType\":\"address\",\"name\":\"\",\"type\":\"address\"}],\"stateMutability\":\"view\",\"type\":\"function\"},{\"inputs\":[],\"name\":\"admin_initialized\",\"outputs\":[{\"internalType\":\"bool\",\"name\":\"\",\"type\":\"bool\"}],\"stateMutability\":\"view\",\"type\":\"function\"},{\"inputs\":[{\"internalType\":\"address\",\"name\":\"target\",\"type\":\"address\"},{\"internalType\":\"uint256\",\"name\":\"value\",\"type\":\"uint256\"},{\"internalType\":\"string\",\"name\":\"signature\",\"type\":\"string\"},{\"internalType\":\"bytes\",\"name\":\"data\",\"type\":\"bytes\"},{\"internalType\":\"uint256\",\"name\":\"eta\",\"type\":\"uint256\"}],\"name\":\"cancelTransaction\",\"outputs\":[],\"stateMutability\":\"nonpayable\",\"type\":\"function\"},{\"inputs\":[],\"name\":\"delay\",\"outputs\":[{\"internalType\":\"uint256\",\"name\":\"\",\"type\":\"uint256\"}],\"stateMutability\":\"view\",\"type\":\"function\"},{\"inputs\":[{\"internalType\":\"address\",\"name\":\"target\",\"type\":\"address\"},{\"internalType\":\"uint256\",\"name\":\"value\",\"type\":\"uint256\"},{\"internalType\":\"string\",\"name\":\"signature\",\"type\":\"string\"},{\"internalType\":\"bytes\",\"name\":\"data\",\"type\":\"bytes\"},{\"internalType\":\"uint256\",\"name\":\"eta\",\"type\":\"uint256\"}],\"name\":\"executeTransaction\",\"outputs\":[{\"internalType\":\"bytes\",\"name\":\"\",\"type\":\"bytes\"}],\"stateMutability\":\"payable\",\"type\":\"function\"},{\"inputs\":[],\"name\":\"pendingAdmin\",\"outputs\":[{\"internalType\":\"address\",\"name\":\"\",\"type\":\"address\"}],\"stateMutability\":\"view\",\"type\":\"function\"},{\"inputs\":[{\"internalType\":\"address\",\"name\":\"target\",\"type\":\"address\"},{\"internalType\":\"uint256\",\"name\":\"value\",\"type\":\"uint256\"},{\"internalType\":\"string\",\"name\":\"signature\",\"type\":\"string\"},{\"internalType\":\"bytes\",\"name\":\"data\",\"type\":\"bytes\"},{\"internalType\":\"uint256\",\"name\":\"eta\",\"type\":\"uint256\"}],\"name\":\"queueTransaction\",\"outputs\":[{\"internalType\":\"bytes32\",\"name\":\"\",\"type\":\"bytes32\"}],\"stateMutability\":\"nonpayable\",\"type\":\"function\"},{\"inputs\":[{\"internalType\":\"bytes32\",\"name\":\"\",\"type\":\"bytes32\"}],\"name\":\"queuedTransactions\",\"outputs\":[{\"internalType\":\"bool\",\"name\":\"\",\"type\":\"bool\"}],\"stateMutability\":\"view\",\"type\":\"function\"},{\"inputs\":[{\"internalType\":\"uint256\",\"name\":\"delay_\",\"type\":\"uint256\"}],\"name\":\"setDelay\",\"outputs\":[],\"stateMutability\":\"nonpayable\",\"type\":\"function\"},{\"inputs\":[{\"internalType\":\"address\",\"name\":\"pendingAdmin_\",\"type\":\"address\"}],\"name\":\"setPendingAdmin\",\"outputs\":[],\"stateMutability\":\"nonpayable\",\"type\":\"function\"},{\"stateMutability\":\"payable\",\"type\":\"receive\"}],\"devdoc\":{\"kind\":\"dev\",\"methods\":{},\"version\":1},\"userdoc\":{\"kind\":\"user\",\"methods\":{},\"version\":1}},\"settings\":{\"compilationTarget\":{\"contracts/helpers/Timelock.sol\":\"Timelock\"},\"evmVersion\":\"istanbul\",\"libraries\":{},\"metadata\":{\"bytecodeHash\":\"ipfs\",\"useLiteralContent\":true},\"optimizer\":{\"enabled\":true,\"runs\":999999},\"remappings\":[]},\"sources\":{\"contracts/helpers/Timelock.sol\":{\"content\":\"// Sources flattened with hardhat v2.6.0 https://hardhat.org\\n\\n// File @openzeppelin/contracts/utils/math/SafeMath.sol@v4.2.0\\n\\n// SPDX-License-Identifier: MIT\\n\\npragma solidity ^0.8.0;\\n\\n// CAUTION\\n// This version of SafeMath should only be used with Solidity 0.8 or later,\\n// because it relies on the compiler's built in overflow checks.\\n\\n/**\\n * @dev Wrappers over Solidity's arithmetic operations.\\n *\\n * NOTE: `SafeMath` is no longer needed starting with Solidity 0.8. The compiler\\n * now has built in overflow checking.\\n */\\nlibrary SafeMath {\\n    /**\\n     * @dev Returns the addition of two unsigned integers, with an overflow flag.\\n     *\\n     * _Available since v3.4._\\n     */\\n    function tryAdd(uint256 a, uint256 b) internal pure returns (bool, uint256) {\\n        unchecked {\\n            uint256 c = a + b;\\n            if (c < a) return (false, 0);\\n            return (true, c);\\n        }\\n    }\\n\\n    /**\\n     * @dev Returns the substraction of two unsigned integers, with an overflow flag.\\n     *\\n     * _Available since v3.4._\\n     */\\n    function trySub(uint256 a, uint256 b) internal pure returns (bool, uint256) {\\n        unchecked {\\n            if (b > a) return (false, 0);\\n            return (true, a - b);\\n        }\\n    }\\n\\n    /**\\n     * @dev Returns the multiplication of two unsigned integers, with an overflow flag.\\n     *\\n     * _Available since v3.4._\\n     */\\n    function tryMul(uint256 a, uint256 b) internal pure returns (bool, uint256) {\\n        unchecked {\\n            // Gas optimization: this is cheaper than requiring 'a' not being zero, but the\\n            // benefit is lost if 'b' is also tested.\\n            // See: https://github.com/OpenZeppelin/openzeppelin-contracts/pull/522\\n            if (a == 0) return (true, 0);\\n            uint256 c = a * b;\\n            if (c / a != b) return (false, 0);\\n            return (true, c);\\n        }\\n    }\\n\\n    /**\\n     * @dev Returns the division of two unsigned integers, with a division by zero flag.\\n     *\\n     * _Available since v3.4._\\n     */\\n    function tryDiv(uint256 a, uint256 b) internal pure returns (bool, uint256) {\\n        unchecked {\\n            if (b == 0) return (false, 0);\\n            return (true, a / b);\\n        }\\n    }\\n\\n    /**\\n     * @dev Returns the remainder of dividing two unsigned integers, with a division by zero flag.\\n     *\\n     * _Available since v3.4._\\n     */\\n    function tryMod(uint256 a, uint256 b) internal pure returns (bool, uint256) {\\n        unchecked {\\n            if (b == 0) return (false, 0);\\n            return (true, a % b);\\n        }\\n    }\\n\\n    /**\\n     * @dev Returns the addition of two unsigned integers, reverting on\\n     * overflow.\\n     *\\n     * Counterpart to Solidity's `+` operator.\\n     *\\n     * Requirements:\\n     *\\n     * - Addition cannot overflow.\\n     */\\n    function add(uint256 a, uint256 b) internal pure returns (uint256) {\\n        return a + b;\\n    }\\n\\n    /**\\n     * @dev Returns the subtraction of two unsigned integers, reverting on\\n     * overflow (when the result is negative).\\n     *\\n     * Counterpart to Solidity's `-` operator.\\n     *\\n     * Requirements:\\n     *\\n     * - Subtraction cannot overflow.\\n     */\\n    function sub(uint256 a, uint256 b) internal pure returns (uint256) {\\n        return a - b;\\n    }\\n\\n    /**\\n     * @dev Returns the multiplication of two unsigned integers, reverting on\\n     * overflow.\\n     *\\n     * Counterpart to Solidity's `*` operator.\\n     *\\n     * Requirements:\\n     *\\n     * - Multiplication cannot overflow.\\n     */\\n    function mul(uint256 a, uint256 b) internal pure returns (uint256) {\\n        return a * b;\\n    }\\n\\n    /**\\n     * @dev Returns the integer division of two unsigned integers, reverting on\\n     * division by zero. The result is rounded towards zero.\\n     *\\n     * Counterpart to Solidity's `/` operator.\\n     *\\n     * Requirements:\\n     *\\n     * - The divisor cannot be zero.\\n     */\\n    function div(uint256 a, uint256 b) internal pure returns (uint256) {\\n        return a / b;\\n    }\\n\\n    /**\\n     * @dev Returns the remainder of dividing two unsigned integers. (unsigned integer modulo),\\n     * reverting when dividing by zero.\\n     *\\n     * Counterpart to Solidity's `%` operator. This function uses a `revert`\\n     * opcode (which leaves remaining gas untouched) while Solidity uses an\\n     * invalid opcode to revert (consuming all remaining gas).\\n     *\\n     * Requirements:\\n     *\\n     * - The divisor cannot be zero.\\n     */\\n    function mod(uint256 a, uint256 b) internal pure returns (uint256) {\\n        return a % b;\\n    }\\n\\n    /**\\n     * @dev Returns the subtraction of two unsigned integers, reverting with custom message on\\n     * overflow (when the result is negative).\\n     *\\n     * CAUTION: This function is deprecated because it requires allocating memory for the error\\n     * message unnecessarily. For custom revert reasons use {trySub}.\\n     *\\n     * Counterpart to Solidity's `-` operator.\\n     *\\n     * Requirements:\\n     *\\n     * - Subtraction cannot overflow.\\n     */\\n    function sub(\\n        uint256 a,\\n        uint256 b,\\n        string memory errorMessage\\n    ) internal pure returns (uint256) {\\n        unchecked {\\n            require(b <= a, errorMessage);\\n            return a - b;\\n        }\\n    }\\n\\n    /**\\n     * @dev Returns the integer division of two unsigned integers, reverting with custom message on\\n     * division by zero. The result is rounded towards zero.\\n     *\\n     * Counterpart to Solidity's `/` operator. Note: this function uses a\\n     * `revert` opcode (which leaves remaining gas untouched) while Solidity\\n     * uses an invalid opcode to revert (consuming all remaining gas).\\n     *\\n     * Requirements:\\n     *\\n     * - The divisor cannot be zero.\\n     */\\n    function div(\\n        uint256 a,\\n        uint256 b,\\n        string memory errorMessage\\n    ) internal pure returns (uint256) {\\n        unchecked {\\n            require(b > 0, errorMessage);\\n            return a / b;\\n        }\\n    }\\n\\n    /**\\n     * @dev Returns the remainder of dividing two unsigned integers. (unsigned integer modulo),\\n     * reverting with custom message when dividing by zero.\\n     *\\n     * CAUTION: This function is deprecated because it requires allocating memory for the error\\n     * message unnecessarily. For custom revert reasons use {tryMod}.\\n     *\\n     * Counterpart to Solidity's `%` operator. This function uses a `revert`\\n     * opcode (which leaves remaining gas untouched) while Solidity uses an\\n     * invalid opcode to revert (consuming all remaining gas).\\n     *\\n     * Requirements:\\n     *\\n     * - The divisor cannot be zero.\\n     */\\n    function mod(\\n        uint256 a,\\n        uint256 b,\\n        string memory errorMessage\\n    ) internal pure returns (uint256) {\\n        unchecked {\\n            require(b > 0, errorMessage);\\n            return a % b;\\n        }\\n    }\\n}\\n\\n// File contracts/helpers/Timelock.sol\\npragma solidity =0.8.2;\\n\\ncontract Timelock {\\n    using SafeMath for uint256;\\n\\n    event NewAdmin(address indexed newAdmin);\\n    event NewPendingAdmin(address indexed newPendingAdmin);\\n    event NewDelay(uint256 indexed newDelay);\\n    event CancelTransaction(\\n        bytes32 indexed txHash,\\n        address indexed target,\\n        uint256 value,\\n        string signature,\\n        bytes data,\\n        uint256 eta\\n    );\\n    event ExecuteTransaction(\\n        bytes32 indexed txHash,\\n        address indexed target,\\n        uint256 value,\\n        string signature,\\n        bytes data,\\n        uint256 eta\\n    );\\n    event QueueTransaction(\\n        bytes32 indexed txHash,\\n        address indexed target,\\n        uint256 value,\\n        string signature,\\n        bytes data,\\n        uint256 eta\\n    );\\n\\n    uint256 public constant GRACE_PERIOD = 14 days;\\n    uint256 public constant MINIMUM_DELAY = 6 hours;\\n    uint256 public constant MAXIMUM_DELAY = 30 days;\\n\\n    address public admin;\\n    address public pendingAdmin;\\n    uint256 public delay;\\n    bool public admin_initialized;\\n\\n    mapping(bytes32 => bool) public queuedTransactions;\\n\\n    constructor(address admin_, uint256 delay_) {\\n        require(\\n            delay_ >= MINIMUM_DELAY,\\n            \\\"Timelock::constructor: Delay must exceed minimum delay.\\\"\\n        );\\n        require(\\n            delay_ <= MAXIMUM_DELAY,\\n            \\\"Timelock::constructor: Delay must not exceed maximum delay.\\\"\\n        );\\n\\n        admin = admin_;\\n        delay = delay_;\\n        admin_initialized = false;\\n    }\\n\\n    // XXX: function() external payable { }\\n    receive() external payable {}\\n\\n    function setDelay(uint256 delay_) public {\\n        require(\\n            msg.sender == address(this),\\n            \\\"Timelock::setDelay: Call must come from Timelock.\\\"\\n        );\\n        require(\\n            delay_ >= MINIMUM_DELAY,\\n            \\\"Timelock::setDelay: Delay must exceed minimum delay.\\\"\\n        );\\n        require(\\n            delay_ <= MAXIMUM_DELAY,\\n            \\\"Timelock::setDelay: Delay must not exceed maximum delay.\\\"\\n        );\\n        delay = delay_;\\n\\n        emit NewDelay(delay);\\n    }\\n\\n    function acceptAdmin() public {\\n        require(\\n            msg.sender == pendingAdmin,\\n            \\\"Timelock::acceptAdmin: Call must come from pendingAdmin.\\\"\\n        );\\n        admin = msg.sender;\\n        pendingAdmin = address(0);\\n\\n        emit NewAdmin(admin);\\n    }\\n\\n    function setPendingAdmin(address pendingAdmin_) public {\\n        // allows one time setting of admin for deployment purposes\\n        if (admin_initialized) {\\n            require(\\n                msg.sender == address(this),\\n                \\\"Timelock::setPendingAdmin: Call must come from Timelock.\\\"\\n            );\\n        } else {\\n            require(\\n                msg.sender == admin,\\n                \\\"Timelock::setPendingAdmin: First call must come from admin.\\\"\\n            );\\n            admin_initialized = true;\\n        }\\n        pendingAdmin = pendingAdmin_;\\n\\n        emit NewPendingAdmin(pendingAdmin);\\n    }\\n\\n    function queueTransaction(\\n        address target,\\n        uint256 value,\\n        string memory signature,\\n        bytes memory data,\\n        uint256 eta\\n    ) public returns (bytes32) {\\n        require(\\n            msg.sender == admin,\\n            \\\"Timelock::queueTransaction: Call must come from admin.\\\"\\n        );\\n        require(\\n            eta >= getBlockTimestamp().add(delay),\\n            \\\"Timelock::queueTransaction: Estimated execution block must satisfy delay.\\\"\\n        );\\n\\n        bytes32 txHash = keccak256(\\n            abi.encode(target, value, signature, data, eta)\\n        );\\n        queuedTransactions[txHash] = true;\\n\\n        emit QueueTransaction(txHash, target, value, signature, data, eta);\\n        return txHash;\\n    }\\n\\n    function cancelTransaction(\\n        address target,\\n        uint256 value,\\n        string memory signature,\\n        bytes memory data,\\n        uint256 eta\\n    ) public {\\n        require(\\n            msg.sender == admin,\\n            \\\"Timelock::cancelTransaction: Call must come from admin.\\\"\\n        );\\n\\n        bytes32 txHash = keccak256(\\n            abi.encode(target, value, signature, data, eta)\\n        );\\n        queuedTransactions[txHash] = false;\\n\\n        emit CancelTransaction(txHash, target, value, signature, data, eta);\\n    }\\n\\n    function executeTransaction(\\n        address target,\\n        uint256 value,\\n        string memory signature,\\n        bytes memory data,\\n        uint256 eta\\n    ) public payable returns (bytes memory) {\\n        require(\\n            msg.sender == admin,\\n            \\\"Timelock::executeTransaction: Call must come from admin.\\\"\\n        );\\n\\n        bytes32 txHash = keccak256(\\n            abi.encode(target, value, signature, data, eta)\\n        );\\n        require(\\n            queuedTransactions[txHash],\\n            \\\"Timelock::executeTransaction: Transaction hasn't been queued.\\\"\\n        );\\n        require(\\n            getBlockTimestamp() >= eta,\\n            \\\"Timelock::executeTransaction: Transaction hasn't surpassed time lock.\\\"\\n        );\\n        require(\\n            getBlockTimestamp() <= eta.add(GRACE_PERIOD),\\n            \\\"Timelock::executeTransaction: Transaction is stale.\\\"\\n        );\\n\\n        queuedTransactions[txHash] = false;\\n\\n        bytes memory callData;\\n\\n        if (bytes(signature).length == 0) {\\n            callData = data;\\n        } else {\\n            callData = abi.encodePacked(\\n                bytes4(keccak256(bytes(signature))),\\n                data\\n            );\\n        }\\n\\n        // solium-disable-next-line security/no-call-value\\n        (bool success, bytes memory returnData) = target.call{value: value}(\\n            callData\\n        );\\n        require(\\n            success,\\n            \\\"Timelock::executeTransaction: Transaction execution reverted.\\\"\\n        );\\n\\n        emit ExecuteTransaction(txHash, target, value, signature, data, eta);\\n\\n        return returnData;\\n    }\\n\\n    function getBlockTimestamp() internal view returns (uint256) {\\n        // solium-disable-next-line security/no-block-members\\n        return block.timestamp;\\n    }\\n}\\n\",\"keccak256\":\"0xc89f5356f90130cd478521058a639c3fb908a05fa1460f11064b62cc69075469\",\"license\":\"MIT\"}},\"version\":1}",
  "bytecode": "0x608060405234801561001057600080fd5b50604051620015f5380380620015f583398101604081905261003191610138565b61546081101561009d5760405162461bcd60e51b81526020600482015260376024820152600080516020620015d583398151915260448201527f7420657863656564206d696e696d756d2064656c61792e00000000000000000060648201526084015b60405180910390fd5b62278d008111156101055760405162461bcd60e51b815260206004820152603b6024820152600080516020620015d583398151915260448201527f74206e6f7420657863656564206d6178696d756d2064656c61792e00000000006064820152608401610094565b600080546001600160a01b0319166001600160a01b0393909316929092179091556002556003805460ff19169055610170565b6000806040838503121561014a578182fd5b82516001600160a01b0381168114610160578283fd5b6020939093015192949293505050565b61145580620001806000396000f3fe6080604052600436106100e15760003560e01c80636fc1f57e1161007f578063c1a287e211610059578063c1a287e21461025a578063e177246e14610271578063f2b0653714610291578063f851a440146102c1576100e8565b80636fc1f57e146102035780637d645fab1461022d578063b1b43ae514610244576100e8565b80633a66f901116100bb5780633a66f9011461017f5780634dd18bf5146101ad578063591fcdfe146101cd5780636a42b8f8146101ed576100e8565b80630825f38f146100ed5780630e18b68114610116578063267822471461012d576100e8565b366100e857005b600080fd5b6101006100fb366004611167565b6102ee565b60405161010d9190611333565b60405180910390f35b34801561012257600080fd5b5061012b6107ae565b005b34801561013957600080fd5b5060015461015a9073ffffffffffffffffffffffffffffffffffffffff1681565b60405173ffffffffffffffffffffffffffffffffffffffff909116815260200161010d565b34801561018b57600080fd5b5061019f61019a366004611167565b6108cd565b60405190815260200161010d565b3480156101b957600080fd5b5061012b6101c836600461114d565b610b25565b3480156101d957600080fd5b5061012b6101e8366004611167565b610d0c565b3480156101f957600080fd5b5061019f60025481565b34801561020f57600080fd5b5060035461021d9060ff1681565b604051901515815260200161010d565b34801561023957600080fd5b5061019f62278d0081565b34801561025057600080fd5b5061019f61546081565b34801561026657600080fd5b5061019f6212750081565b34801561027d57600080fd5b5061012b61028c366004611213565b610e96565b34801561029d57600080fd5b5061021d6102ac366004611213565b60046020526000908152604090205460ff1681565b3480156102cd57600080fd5b5060005461015a9073ffffffffffffffffffffffffffffffffffffffff1681565b60005460609073ffffffffffffffffffffffffffffffffffffffff16331461039d576040517f08c379a000000000000000000000000000000000000000000000000000000000815260206004820152603860248201527f54696d656c6f636b3a3a657865637574655472616e73616374696f6e3a20436160448201527f6c6c206d75737420636f6d652066726f6d2061646d696e2e000000000000000060648201526084015b60405180910390fd5b600086868686866040516020016103b89594939291906112d9565b604080517fffffffffffffffffffffffffffffffffffffffffffffffffffffffffffffffe081840301815291815281516020928301206000818152600490935291205490915060ff1661048d576040517f08c379a000000000000000000000000000000000000000000000000000000000815260206004820152603d60248201527f54696d656c6f636b3a3a657865637574655472616e73616374696f6e3a20547260448201527f616e73616374696f6e206861736e2774206265656e207175657565642e0000006064820152608401610394565b82421015610543576040517f08c379a000000000000000000000000000000000000000000000000000000000815260206004820152604560248201527f54696d656c6f636b3a3a657865637574655472616e73616374696f6e3a20547260448201527f616e73616374696f6e206861736e2774207375727061737365642074696d652060648201527f6c6f636b2e000000000000000000000000000000000000000000000000000000608482015260a401610394565b610550836212750061107d565b4211156105df576040517f08c379a000000000000000000000000000000000000000000000000000000000815260206004820152603360248201527f54696d656c6f636b3a3a657865637574655472616e73616374696f6e3a20547260448201527f616e73616374696f6e206973207374616c652e000000000000000000000000006064820152608401610394565b600081815260046020526040902080547fffffffffffffffffffffffffffffffffffffffffffffffffffffffffffffff00169055845160609061062357508361064f565b85805190602001208560405160200161063d929190611275565b60405160208183030381529060405290505b6000808973ffffffffffffffffffffffffffffffffffffffff16898460405161067891906112bd565b60006040518083038185875af1925050503d80600081146106b5576040519150601f19603f3d011682016040523d82523d6000602084013e6106ba565b606091505b50915091508161074c576040517f08c379a000000000000000000000000000000000000000000000000000000000815260206004820152603d60248201527f54696d656c6f636b3a3a657865637574655472616e73616374696f6e3a20547260448201527f616e73616374696f6e20657865637574696f6e2072657665727465642e0000006064820152608401610394565b8973ffffffffffffffffffffffffffffffffffffffff16847fa560e3198060a2f10670c1ec5b403077ea6ae93ca8de1c32b451dc1a943cd6e78b8b8b8b6040516107999493929190611346565b60405180910390a39998505050505050505050565b60015473ffffffffffffffffffffffffffffffffffffffff163314610855576040517f08c379a000000000000000000000000000000000000000000000000000000000815260206004820152603860248201527f54696d656c6f636b3a3a61636365707441646d696e3a2043616c6c206d75737460448201527f20636f6d652066726f6d2070656e64696e6741646d696e2e00000000000000006064820152608401610394565b60008054337fffffffffffffffffffffffff0000000000000000000000000000000000000000918216178083556001805490921690915560405173ffffffffffffffffffffffffffffffffffffffff909116917f71614071b88dee5e0b2ae578a9dd7b2ebbe9ae832ba419dc0242cd065a290b6c91a2565b6000805473ffffffffffffffffffffffffffffffffffffffff163314610975576040517f08c379a000000000000000000000000000000000000000000000000000000000815260206004820152603660248201527f54696d656c6f636b3a3a71756575655472616e73616374696f6e3a2043616c6c60448201527f206d75737420636f6d652066726f6d2061646d696e2e000000000000000000006064820152608401610394565b6109886002546109824290565b9061107d565b821015610a3d576040517f08c379a000000000000000000000000000000000000000000000000000000000815260206004820152604960248201527f54696d656c6f636b3a3a71756575655472616e73616374696f6e3a204573746960448201527f6d6174656420657865637574696f6e20626c6f636b206d75737420736174697360648201527f66792064656c61792e0000000000000000000000000000000000000000000000608482015260a401610394565b60008686868686604051602001610a589594939291906112d9565b604080517fffffffffffffffffffffffffffffffffffffffffffffffffffffffffffffffe081840301815282825280516020918201206000818152600490925291902080547fffffffffffffffffffffffffffffffffffffffffffffffffffffffffffffff00166001179055915073ffffffffffffffffffffffffffffffffffffffff88169082907f76e2796dc3a81d57b0e8504b647febcbeeb5f4af818e164f11eef8131a6a763f90610b13908a908a908a908a90611346565b60405180910390a39695505050505050565b60035460ff1615610bc457333014610bbf576040517f08c379a000000000000000000000000000000000000000000000000000000000815260206004820152603860248201527f54696d656c6f636b3a3a73657450656e64696e6741646d696e3a2043616c6c2060448201527f6d75737420636f6d652066726f6d2054696d656c6f636b2e00000000000000006064820152608401610394565b610c97565b60005473ffffffffffffffffffffffffffffffffffffffff163314610c6b576040517f08c379a000000000000000000000000000000000000000000000000000000000815260206004820152603b60248201527f54696d656c6f636b3a3a73657450656e64696e6741646d696e3a20466972737460448201527f2063616c6c206d75737420636f6d652066726f6d2061646d696e2e00000000006064820152608401610394565b600380547fffffffffffffffffffffffffffffffffffffffffffffffffffffffffffffff001660011790555b600180547fffffffffffffffffffffffff00000000000000000000000000000000000000001673ffffffffffffffffffffffffffffffffffffffff83811691909117918290556040519116907f69d78e38a01985fbb1462961809b4b2d65531bc93b2b94037f3334b82ca4a75690600090a250565b60005473ffffffffffffffffffffffffffffffffffffffff163314610db3576040517f08c379a000000000000000000000000000000000000000000000000000000000815260206004820152603760248201527f54696d656c6f636b3a3a63616e63656c5472616e73616374696f6e3a2043616c60448201527f6c206d75737420636f6d652066726f6d2061646d696e2e0000000000000000006064820152608401610394565b60008585858585604051602001610dce9594939291906112d9565b604080517fffffffffffffffffffffffffffffffffffffffffffffffffffffffffffffffe081840301815282825280516020918201206000818152600490925291902080547fffffffffffffffffffffffffffffffffffffffffffffffffffffffffffffff00169055915073ffffffffffffffffffffffffffffffffffffffff87169082907f2fffc091a501fd91bfbff27141450d3acb40fb8e6d8382b243ec7a812a3aaf8790610e86908990899089908990611346565b60405180910390a3505050505050565b333014610f25576040517f08c379a000000000000000000000000000000000000000000000000000000000815260206004820152603160248201527f54696d656c6f636b3a3a73657444656c61793a2043616c6c206d75737420636f60448201527f6d652066726f6d2054696d656c6f636b2e0000000000000000000000000000006064820152608401610394565b615460811015610fb7576040517f08c379a000000000000000000000000000000000000000000000000000000000815260206004820152603460248201527f54696d656c6f636b3a3a73657444656c61793a2044656c6179206d757374206560448201527f7863656564206d696e696d756d2064656c61792e0000000000000000000000006064820152608401610394565b62278d0081111561104a576040517f08c379a000000000000000000000000000000000000000000000000000000000815260206004820152603860248201527f54696d656c6f636b3a3a73657444656c61793a2044656c6179206d757374206e60448201527f6f7420657863656564206d6178696d756d2064656c61792e00000000000000006064820152608401610394565b600281905560405181907f948b1f6a42ee138b7e34058ba85a37f716d55ff25ff05a763f15bed6a04c8d2c90600090a250565b60006110898284611383565b9392505050565b600067ffffffffffffffff808411156110ab576110ab6113f0565b604051601f85017fffffffffffffffffffffffffffffffffffffffffffffffffffffffffffffffe0908116603f011681019082821181831017156110f1576110f16113f0565b8160405280935085815286868601111561110a57600080fd5b858560208301376000602087830101525050509392505050565b803573ffffffffffffffffffffffffffffffffffffffff8116811461114857600080fd5b919050565b60006020828403121561115e578081fd5b61108982611124565b600080600080600060a0868803121561117e578081fd5b61118786611124565b945060208601359350604086013567ffffffffffffffff808211156111aa578283fd5b818801915088601f8301126111bd578283fd5b6111cc89833560208501611090565b945060608801359150808211156111e1578283fd5b508601601f810188136111f2578182fd5b61120188823560208401611090565b95989497509295608001359392505050565b600060208284031215611224578081fd5b5035919050565b600081518084526112438160208601602086016113c0565b601f017fffffffffffffffffffffffffffffffffffffffffffffffffffffffffffffffe0169290920160200192915050565b60007fffffffff000000000000000000000000000000000000000000000000000000008416825282516112af8160048501602087016113c0565b919091016004019392505050565b600082516112cf8184602087016113c0565b9190910192915050565b600073ffffffffffffffffffffffffffffffffffffffff8716825285602083015260a0604083015261130e60a083018661122b565b8281036060840152611320818661122b565b9150508260808301529695505050505050565b600060208252611089602083018461122b565b60008582526080602083015261135f608083018661122b565b8281036040840152611371818661122b565b91505082606083015295945050505050565b600082198211156113bb577f4e487b710000000000000000000000000000000000000000000000000000000081526011600452602481fd5b500190565b60005b838110156113db5781810151838201526020016113c3565b838111156113ea576000848401525b50505050565b7f4e487b7100000000000000000000000000000000000000000000000000000000600052604160045260246000fdfea26469706673582212206f087e112544b91040fc3d6f0781107899892bd9b6f8df632d99c0c60c72a0eb64736f6c6343000802003354696d656c6f636b3a3a636f6e7374727563746f723a2044656c6179206d7573",
  "deployedBytecode": "0x6080604052600436106100e15760003560e01c80636fc1f57e1161007f578063c1a287e211610059578063c1a287e21461025a578063e177246e14610271578063f2b0653714610291578063f851a440146102c1576100e8565b80636fc1f57e146102035780637d645fab1461022d578063b1b43ae514610244576100e8565b80633a66f901116100bb5780633a66f9011461017f5780634dd18bf5146101ad578063591fcdfe146101cd5780636a42b8f8146101ed576100e8565b80630825f38f146100ed5780630e18b68114610116578063267822471461012d576100e8565b366100e857005b600080fd5b6101006100fb366004611167565b6102ee565b60405161010d9190611333565b60405180910390f35b34801561012257600080fd5b5061012b6107ae565b005b34801561013957600080fd5b5060015461015a9073ffffffffffffffffffffffffffffffffffffffff1681565b60405173ffffffffffffffffffffffffffffffffffffffff909116815260200161010d565b34801561018b57600080fd5b5061019f61019a366004611167565b6108cd565b60405190815260200161010d565b3480156101b957600080fd5b5061012b6101c836600461114d565b610b25565b3480156101d957600080fd5b5061012b6101e8366004611167565b610d0c565b3480156101f957600080fd5b5061019f60025481565b34801561020f57600080fd5b5060035461021d9060ff1681565b604051901515815260200161010d565b34801561023957600080fd5b5061019f62278d0081565b34801561025057600080fd5b5061019f61546081565b34801561026657600080fd5b5061019f6212750081565b34801561027d57600080fd5b5061012b61028c366004611213565b610e96565b34801561029d57600080fd5b5061021d6102ac366004611213565b60046020526000908152604090205460ff1681565b3480156102cd57600080fd5b5060005461015a9073ffffffffffffffffffffffffffffffffffffffff1681565b60005460609073ffffffffffffffffffffffffffffffffffffffff16331461039d576040517f08c379a000000000000000000000000000000000000000000000000000000000815260206004820152603860248201527f54696d656c6f636b3a3a657865637574655472616e73616374696f6e3a20436160448201527f6c6c206d75737420636f6d652066726f6d2061646d696e2e000000000000000060648201526084015b60405180910390fd5b600086868686866040516020016103b89594939291906112d9565b604080517fffffffffffffffffffffffffffffffffffffffffffffffffffffffffffffffe081840301815291815281516020928301206000818152600490935291205490915060ff1661048d576040517f08c379a000000000000000000000000000000000000000000000000000000000815260206004820152603d60248201527f54696d656c6f636b3a3a657865637574655472616e73616374696f6e3a20547260448201527f616e73616374696f6e206861736e2774206265656e207175657565642e0000006064820152608401610394565b82421015610543576040517f08c379a000000000000000000000000000000000000000000000000000000000815260206004820152604560248201527f54696d656c6f636b3a3a657865637574655472616e73616374696f6e3a20547260448201527f616e73616374696f6e206861736e2774207375727061737365642074696d652060648201527f6c6f636b2e000000000000000000000000000000000000000000000000000000608482015260a401610394565b610550836212750061107d565b4211156105df576040517f08c379a000000000000000000000000000000000000000000000000000000000815260206004820152603360248201527f54696d656c6f636b3a3a657865637574655472616e73616374696f6e3a20547260448201527f616e73616374696f6e206973207374616c652e000000000000000000000000006064820152608401610394565b600081815260046020526040902080547fffffffffffffffffffffffffffffffffffffffffffffffffffffffffffffff00169055845160609061062357508361064f565b85805190602001208560405160200161063d929190611275565b60405160208183030381529060405290505b6000808973ffffffffffffffffffffffffffffffffffffffff16898460405161067891906112bd565b60006040518083038185875af1925050503d80600081146106b5576040519150601f19603f3d011682016040523d82523d6000602084013e6106ba565b606091505b50915091508161074c576040517f08c379a000000000000000000000000000000000000000000000000000000000815260206004820152603d60248201527f54696d656c6f636b3a3a657865637574655472616e73616374696f6e3a20547260448201527f616e73616374696f6e20657865637574696f6e2072657665727465642e0000006064820152608401610394565b8973ffffffffffffffffffffffffffffffffffffffff16847fa560e3198060a2f10670c1ec5b403077ea6ae93ca8de1c32b451dc1a943cd6e78b8b8b8b6040516107999493929190611346565b60405180910390a39998505050505050505050565b60015473ffffffffffffffffffffffffffffffffffffffff163314610855576040517f08c379a000000000000000000000000000000000000000000000000000000000815260206004820152603860248201527f54696d656c6f636b3a3a61636365707441646d696e3a2043616c6c206d75737460448201527f20636f6d652066726f6d2070656e64696e6741646d696e2e00000000000000006064820152608401610394565b60008054337fffffffffffffffffffffffff0000000000000000000000000000000000000000918216178083556001805490921690915560405173ffffffffffffffffffffffffffffffffffffffff909116917f71614071b88dee5e0b2ae578a9dd7b2ebbe9ae832ba419dc0242cd065a290b6c91a2565b6000805473ffffffffffffffffffffffffffffffffffffffff163314610975576040517f08c379a000000000000000000000000000000000000000000000000000000000815260206004820152603660248201527f54696d656c6f636b3a3a71756575655472616e73616374696f6e3a2043616c6c60448201527f206d75737420636f6d652066726f6d2061646d696e2e000000000000000000006064820152608401610394565b6109886002546109824290565b9061107d565b821015610a3d576040517f08c379a000000000000000000000000000000000000000000000000000000000815260206004820152604960248201527f54696d656c6f636b3a3a71756575655472616e73616374696f6e3a204573746960448201527f6d6174656420657865637574696f6e20626c6f636b206d75737420736174697360648201527f66792064656c61792e0000000000000000000000000000000000000000000000608482015260a401610394565b60008686868686604051602001610a589594939291906112d9565b604080517fffffffffffffffffffffffffffffffffffffffffffffffffffffffffffffffe081840301815282825280516020918201206000818152600490925291902080547fffffffffffffffffffffffffffffffffffffffffffffffffffffffffffffff00166001179055915073ffffffffffffffffffffffffffffffffffffffff88169082907f76e2796dc3a81d57b0e8504b647febcbeeb5f4af818e164f11eef8131a6a763f90610b13908a908a908a908a90611346565b60405180910390a39695505050505050565b60035460ff1615610bc457333014610bbf576040517f08c379a000000000000000000000000000000000000000000000000000000000815260206004820152603860248201527f54696d656c6f636b3a3a73657450656e64696e6741646d696e3a2043616c6c2060448201527f6d75737420636f6d652066726f6d2054696d656c6f636b2e00000000000000006064820152608401610394565b610c97565b60005473ffffffffffffffffffffffffffffffffffffffff163314610c6b576040517f08c379a000000000000000000000000000000000000000000000000000000000815260206004820152603b60248201527f54696d656c6f636b3a3a73657450656e64696e6741646d696e3a20466972737460448201527f2063616c6c206d75737420636f6d652066726f6d2061646d696e2e00000000006064820152608401610394565b600380547fffffffffffffffffffffffffffffffffffffffffffffffffffffffffffffff001660011790555b600180547fffffffffffffffffffffffff00000000000000000000000000000000000000001673ffffffffffffffffffffffffffffffffffffffff83811691909117918290556040519116907f69d78e38a01985fbb1462961809b4b2d65531bc93b2b94037f3334b82ca4a75690600090a250565b60005473ffffffffffffffffffffffffffffffffffffffff163314610db3576040517f08c379a000000000000000000000000000000000000000000000000000000000815260206004820152603760248201527f54696d656c6f636b3a3a63616e63656c5472616e73616374696f6e3a2043616c60448201527f6c206d75737420636f6d652066726f6d2061646d696e2e0000000000000000006064820152608401610394565b60008585858585604051602001610dce9594939291906112d9565b604080517fffffffffffffffffffffffffffffffffffffffffffffffffffffffffffffffe081840301815282825280516020918201206000818152600490925291902080547fffffffffffffffffffffffffffffffffffffffffffffffffffffffffffffff00169055915073ffffffffffffffffffffffffffffffffffffffff87169082907f2fffc091a501fd91bfbff27141450d3acb40fb8e6d8382b243ec7a812a3aaf8790610e86908990899089908990611346565b60405180910390a3505050505050565b333014610f25576040517f08c379a000000000000000000000000000000000000000000000000000000000815260206004820152603160248201527f54696d656c6f636b3a3a73657444656c61793a2043616c6c206d75737420636f60448201527f6d652066726f6d2054696d656c6f636b2e0000000000000000000000000000006064820152608401610394565b615460811015610fb7576040517f08c379a000000000000000000000000000000000000000000000000000000000815260206004820152603460248201527f54696d656c6f636b3a3a73657444656c61793a2044656c6179206d757374206560448201527f7863656564206d696e696d756d2064656c61792e0000000000000000000000006064820152608401610394565b62278d0081111561104a576040517f08c379a000000000000000000000000000000000000000000000000000000000815260206004820152603860248201527f54696d656c6f636b3a3a73657444656c61793a2044656c6179206d757374206e60448201527f6f7420657863656564206d6178696d756d2064656c61792e00000000000000006064820152608401610394565b600281905560405181907f948b1f6a42ee138b7e34058ba85a37f716d55ff25ff05a763f15bed6a04c8d2c90600090a250565b60006110898284611383565b9392505050565b600067ffffffffffffffff808411156110ab576110ab6113f0565b604051601f85017fffffffffffffffffffffffffffffffffffffffffffffffffffffffffffffffe0908116603f011681019082821181831017156110f1576110f16113f0565b8160405280935085815286868601111561110a57600080fd5b858560208301376000602087830101525050509392505050565b803573ffffffffffffffffffffffffffffffffffffffff8116811461114857600080fd5b919050565b60006020828403121561115e578081fd5b61108982611124565b600080600080600060a0868803121561117e578081fd5b61118786611124565b945060208601359350604086013567ffffffffffffffff808211156111aa578283fd5b818801915088601f8301126111bd578283fd5b6111cc89833560208501611090565b945060608801359150808211156111e1578283fd5b508601601f810188136111f2578182fd5b61120188823560208401611090565b95989497509295608001359392505050565b600060208284031215611224578081fd5b5035919050565b600081518084526112438160208601602086016113c0565b601f017fffffffffffffffffffffffffffffffffffffffffffffffffffffffffffffffe0169290920160200192915050565b60007fffffffff000000000000000000000000000000000000000000000000000000008416825282516112af8160048501602087016113c0565b919091016004019392505050565b600082516112cf8184602087016113c0565b9190910192915050565b600073ffffffffffffffffffffffffffffffffffffffff8716825285602083015260a0604083015261130e60a083018661122b565b8281036060840152611320818661122b565b9150508260808301529695505050505050565b600060208252611089602083018461122b565b60008582526080602083015261135f608083018661122b565b8281036040840152611371818661122b565b91505082606083015295945050505050565b600082198211156113bb577f4e487b710000000000000000000000000000000000000000000000000000000081526011600452602481fd5b500190565b60005b838110156113db5781810151838201526020016113c3565b838111156113ea576000848401525b50505050565b7f4e487b7100000000000000000000000000000000000000000000000000000000600052604160045260246000fdfea26469706673582212206f087e112544b91040fc3d6f0781107899892bd9b6f8df632d99c0c60c72a0eb64736f6c63430008020033",
  "devdoc": {
    "kind": "dev",
    "methods": {},
    "version": 1
  },
  "userdoc": {
    "kind": "user",
    "methods": {},
    "version": 1
  },
  "storageLayout": {
    "storage": [
      {
        "astId": 380,
        "contract": "contracts/helpers/Timelock.sol:Timelock",
        "label": "admin",
        "offset": 0,
        "slot": "0",
        "type": "t_address"
      },
      {
        "astId": 382,
        "contract": "contracts/helpers/Timelock.sol:Timelock",
        "label": "pendingAdmin",
        "offset": 0,
        "slot": "1",
        "type": "t_address"
      },
      {
        "astId": 384,
        "contract": "contracts/helpers/Timelock.sol:Timelock",
        "label": "delay",
        "offset": 0,
        "slot": "2",
        "type": "t_uint256"
      },
      {
        "astId": 386,
        "contract": "contracts/helpers/Timelock.sol:Timelock",
        "label": "admin_initialized",
        "offset": 0,
        "slot": "3",
        "type": "t_bool"
      },
      {
        "astId": 390,
        "contract": "contracts/helpers/Timelock.sol:Timelock",
        "label": "queuedTransactions",
        "offset": 0,
        "slot": "4",
        "type": "t_mapping(t_bytes32,t_bool)"
      }
    ],
    "types": {
      "t_address": {
        "encoding": "inplace",
        "label": "address",
        "numberOfBytes": "20"
      },
      "t_bool": {
        "encoding": "inplace",
        "label": "bool",
        "numberOfBytes": "1"
      },
      "t_bytes32": {
        "encoding": "inplace",
        "label": "bytes32",
        "numberOfBytes": "32"
      },
      "t_mapping(t_bytes32,t_bool)": {
        "encoding": "mapping",
        "key": "t_bytes32",
        "label": "mapping(bytes32 => bool)",
        "numberOfBytes": "32",
        "value": "t_bool"
      },
      "t_uint256": {
        "encoding": "inplace",
        "label": "uint256",
        "numberOfBytes": "32"
      }
    }
  }
}